A1: 臺北捷運公司運量統計表
A2: 營運日 | B2: 星期 | C2: 總 運 量
A3: 40725 | B3: =CHOOSE(WEEKDAY(A3,1),"日","一","二","三","四","五","六") -> 五 | C3: 1715240
A4: =A3+1 -> 40726 | B4: =CHOOSE(WEEKDAY(A4,1),"日","一","二","三","四","五","六") -> 六 | C4: 1494650
A5: =A4+1 -> 40727 | B5: =CHOOSE(WEEKDAY(A5,1),"日","一","二","三","四","五","六") -> 日 | C5: 1327672
A6: =A5+1 -> 40728 | B6: =CHOOSE(WEEKDAY(A6,1),"日","一","二","三","四","五","六") -> 一 | C6: 1559434
A7: =A6+1 -> 40729 | B7: =CHOOSE(WEEKDAY(A7,1),"日","一","二","三","四","五","六") -> 二 | C7: 1588760
A8: =A7+1 -> 40730 | B8: =CHOOSE(WEEKDAY(A8,1),"日","一","二","三","四","五","六") -> 三 | C8: 1609792
A9: =A8+1 -> 40731 | B9: =CHOOSE(WEEKDAY(A9,1),"日","一","二","三","四","五","六") -> 四 | C9: 1617280
A10: =A9+1 -> 40732 | B10: =CHOOSE(WEEKDAY(A10,1),"日","一","二","三","四","五","六") -> 五 | C10: 1729466
A11: =A10+1 -> 40733 | B11: =CHOOSE(WEEKDAY(A11,1),"日","一","二","三","四","五","六") -> 六 | C11: 1492721
A12: =A11+1 -> 40734 | B12: =CHOOSE(WEEKDAY(A12,1),"日","一","二","三","四","五","六") -> 日 | C12: 1307442
A13: =A12+1 -> 40735 | B13: =CHOOSE(WEEKDAY(A13,1),"日","一","二","三","四","五","六") -> 一 | C13: 1553148
A14: =A13+1 -> 40736 | B14: =CHOOSE(WEEKDAY(A14,1),"日","一","二","三","四","五","六") -> 二 | C14: 1598855
A15: =A14+1 -> 40737 | B15: =CHOOSE(WEEKDAY(A15,1),"日","一","二","三","四","五","六") -> 三 | C15: 1573575
A16: =A15+1 -> 40738 | B16: =CHOOSE(WEEKDAY(A16,1),"日","一","二","三","四","五","六") -> 四 | C16: 1619325
A17: =A16+1 -> 40739 | B17: =CHOOSE(WEEKDAY(A17,1),"日","一","二","三","四","五","六") -> 五 | C17: 1696564
A18: =A17+1 -> 40740 | B18: =CHOOSE(WEEKDAY(A18,1),"日","一","二","三","四","五","六") -> 六 | C18: 1516598
A19: =A18+1 -> 40741 | B19: =CHOOSE(WEEKDAY(A19,1),"日","一","二","三","四","五","六") -> 日 | C19: 1304949
A20: =A19+1 -> 40742 | B20: =CHOOSE(WEEKDAY(A20,1),"日","一","二","三","四","五","六") -> 一 | C20: 1563827
A21: =A20+1 -> 40743 | B21: =CHOOSE(WEEKDAY(A21,1),"日","一","二","三","四","五","六") -> 二 | C21: 1599427
A22: =A21+1 -> 40744 | B22: =CHOOSE(WEEKDAY(A22,1),"日","一","二","三","四","五","六") -> 三 | C22: 1610647
A23: =A22+1 -> 40745 | B23: =CHOOSE(WEEKDAY(A23,1),"日","一","二","三","四","五","六") -> 四 | C23: 1614920
A24: =A23+1 -> 40746 | B24: =CHOOSE(WEEKDAY(A24,1),"日","一","二","三","四","五","六") -> 五 | C24: 1708182
A25: =A24+1 -> 40747 | B25: =CHOOSE(WEEKDAY(A25,1),"日","一","二","三","四","五","六") -> 六 | C25: 1563760
A26: =A25+1 -> 40748 | B26: =CHOOSE(WEEKDAY(A26,1),"日","一","二","三","四","五","六") -> 日 | C26: 1328207
A27: =A26+1 -> 40749 | B27: =CHOOSE(WEEKDAY(A27,1),"日","一","二","三","四","五","六") -> 一 | C27: 1533195
A28: =A27+1 -> 40750 | B28: =CHOOSE(WEEKDAY(A28,1),"日","一","二","三","四","五","六") -> 二 | C28: 1552109
A29: =A28+1 -> 40751 | B29: =CHOOSE(WEEKDAY(A29,1),"日","一","二","三","四","五","六") -> 三 | C29: 1606189
A30: =A29+1 -> 40752 | B30: =CHOOSE(WEEKDAY(A30,1),"日","一","二","三","四","五","六") -> 四 | C30: 1613207
A31: =A30+1 -> 40753 | B31: =CHOOSE(WEEKDAY(A31,1),"日","一","二","三","四","五","六") -> 五 | C31: 1711315
A32: =A31+1 -> 40754 | B32: =CHOOSE(WEEKDAY(A32,1),"日","一","二","三","四","五","六") -> 六 | C32: 1563762
A33: =A32+1 -> 40755 | B33: =CHOOSE(WEEKDAY(A33,1),"日","一","二","三","四","五","六") -> 日 | C33: 1330114
A34: 當月總計 | C34: =SUM(C3:C33) -> 48204332
A35: 日平均 | C35: =C34/31 -> 1554978.4516129033
C36: 單位：人次