A1: 臺北捷運公司運量統計表
A2: 營運日 | B2: 星期 | C2: 總 運 量
A3: 40544 | B3: =CHOOSE(WEEKDAY(A3,1),"日","一","二","三","四","五","六") -> 六 | C3: 1466039
A4: =A3+1 -> 40545 | B4: =CHOOSE(WEEKDAY(A4,1),"日","一","二","三","四","五","六") -> 日 | C4: 1203553
A5: =A4+1 -> 40546 | B5: =CHOOSE(WEEKDAY(A5,1),"日","一","二","三","四","五","六") -> 一 | C5: 1474180
A6: =A5+1 -> 40547 | B6: =CHOOSE(WEEKDAY(A6,1),"日","一","二","三","四","五","六") -> 二 | C6: 1491874
A7: =A6+1 -> 40548 | B7: =CHOOSE(WEEKDAY(A7,1),"日","一","二","三","四","五","六") -> 三 | C7: 1537594
A8: =A7+1 -> 40549 | B8: =CHOOSE(WEEKDAY(A8,1),"日","一","二","三","四","五","六") -> 四 | C8: 1515889
A9: =A8+1 -> 40550 | B9: =CHOOSE(WEEKDAY(A9,1),"日","一","二","三","四","五","六") -> 五 | C9: 1651960
A10: =A9+1 -> 40551 | B10: =CHOOSE(WEEKDAY(A10,1),"日","一","二","三","四","五","六") -> 六 | C10: 1432420
A11: =A10+1 -> 40552 | B11: =CHOOSE(WEEKDAY(A11,1),"日","一","二","三","四","五","六") -> 日 | C11: 1142134
A12: =A11+1 -> 40553 | B12: =CHOOSE(WEEKDAY(A12,1),"日","一","二","三","四","五","六") -> 一 | C12: 1498445
A13: =A12+1 -> 40554 | B13: =CHOOSE(WEEKDAY(A13,1),"日","一","二","三","四","五","六") -> 二 | C13: 1509751
A14: =A13+1 -> 40555 | B14: =CHOOSE(WEEKDAY(A14,1),"日","一","二","三","四","五","六") -> 三 | C14: 1529225
A15: =A14+1 -> 40556 | B15: =CHOOSE(WEEKDAY(A15,1),"日","一","二","三","四","五","六") -> 四 | C15: 1557520
A16: =A15+1 -> 40557 | B16: =CHOOSE(WEEKDAY(A16,1),"日","一","二","三","四","五","六") -> 五 | C16: 1718748
A17: =A16+1 -> 40558 | B17: =CHOOSE(WEEKDAY(A17,1),"日","一","二","三","四","五","六") -> 六 | C17: 1426778
A18: =A17+1 -> 40559 | B18: =CHOOSE(WEEKDAY(A18,1),"日","一","二","三","四","五","六") -> 日 | C18: 1170558
A19: =A18+1 -> 40560 | B19: =CHOOSE(WEEKDAY(A19,1),"日","一","二","三","四","五","六") -> 一 | C19: 1521439
A20: =A19+1 -> 40561 | B20: =CHOOSE(WEEKDAY(A20,1),"日","一","二","三","四","五","六") -> 二 | C20: 1543897
A21: =A20+1 -> 40562 | B21: =CHOOSE(WEEKDAY(A21,1),"日","一","二","三","四","五","六") -> 三 | C21: 1574965
A22: =A21+1 -> 40563 | B22: =CHOOSE(WEEKDAY(A22,1),"日","一","二","三","四","五","六") -> 四 | C22: 1710619
A23: =A22+1 -> 40564 | B23: =CHOOSE(WEEKDAY(A23,1),"日","一","二","三","四","五","六") -> 五 | C23: 1737409
A24: =A23+1 -> 40565 | B24: =CHOOSE(WEEKDAY(A24,1),"日","一","二","三","四","五","六") -> 六 | C24: 1573811
A25: =A24+1 -> 40566 | B25: =CHOOSE(WEEKDAY(A25,1),"日","一","二","三","四","五","六") -> 日 | C25: 1331860
A26: =A25+1 -> 40567 | B26: =CHOOSE(WEEKDAY(A26,1),"日","一","二","三","四","五","六") -> 一 | C26: 1569373
A27: =A26+1 -> 40568 | B27: =CHOOSE(WEEKDAY(A27,1),"日","一","二","三","四","五","六") -> 二 | C27: 1611929
A28: =A27+1 -> 40569 | B28: =CHOOSE(WEEKDAY(A28,1),"日","一","二","三","四","五","六") -> 三 | C28: 1687563
A29: =A28+1 -> 40570 | B29: =CHOOSE(WEEKDAY(A29,1),"日","一","二","三","四","五","六") -> 四 | C29: 1662195
A30: =A29+1 -> 40571 | B30: =CHOOSE(WEEKDAY(A30,1),"日","一","二","三","四","五","六") -> 五 | C30: 1736814
A31: =A30+1 -> 40572 | B31: =CHOOSE(WEEKDAY(A31,1),"日","一","二","三","四","五","六") -> 六 | C31: 1418028
A32: =A31+1 -> 40573 | B32: =CHOOSE(WEEKDAY(A32,1),"日","一","二","三","四","五","六") -> 日 | C32: 1219504
A33: =A32+1 -> 40574 | B33: =CHOOSE(WEEKDAY(A33,1),"日","一","二","三","四","五","六") -> 一 | C33: 1543232
A34: 當月總計 | C34: =SUM(C3:C33) -> 46769306
A35: 日平均 | C35: =C34/31 -> 1508687.2903225806
C36: 單位：人次