A1: 臺北捷運公司運量統計表
A2: 營運日 | B2: 星期 | C2: 總 運 量
A3: 40787 | B3: =CHOOSE(WEEKDAY(A3,1),"日","一","二","三","四","五","六") -> 四 | C3: 1583691
A4: =A3+1 -> 40788 | B4: =CHOOSE(WEEKDAY(A4,1),"日","一","二","三","四","五","六") -> 五 | C4: 1700319
A5: =A4+1 -> 40789 | B5: =CHOOSE(WEEKDAY(A5,1),"日","一","二","三","四","五","六") -> 六 | C5: 1555429
A6: =A5+1 -> 40790 | B6: =CHOOSE(WEEKDAY(A6,1),"日","一","二","三","四","五","六") -> 日 | C6: 1324514
A7: =A6+1 -> 40791 | B7: =CHOOSE(WEEKDAY(A7,1),"日","一","二","三","四","五","六") -> 一 | C7: 1566914
A8: =A7+1 -> 40792 | B8: =CHOOSE(WEEKDAY(A8,1),"日","一","二","三","四","五","六") -> 二 | C8: 1587480
A9: =A8+1 -> 40793 | B9: =CHOOSE(WEEKDAY(A9,1),"日","一","二","三","四","五","六") -> 三 | C9: 1620712
A10: =A9+1 -> 40794 | B10: =CHOOSE(WEEKDAY(A10,1),"日","一","二","三","四","五","六") -> 四 | C10: 1625670
A11: =A10+1 -> 40795 | B11: =CHOOSE(WEEKDAY(A11,1),"日","一","二","三","四","五","六") -> 五 | C11: 1764542
A12: =A11+1 -> 40796 | B12: =CHOOSE(WEEKDAY(A12,1),"日","一","二","三","四","五","六") -> 六 | C12: 1424782
A13: =A12+1 -> 40797 | B13: =CHOOSE(WEEKDAY(A13,1),"日","一","二","三","四","五","六") -> 日 | C13: 1236592
A14: =A13+1 -> 40798 | B14: =CHOOSE(WEEKDAY(A14,1),"日","一","二","三","四","五","六") -> 一 | C14: 1064644
A15: =A14+1 -> 40799 | B15: =CHOOSE(WEEKDAY(A15,1),"日","一","二","三","四","五","六") -> 二 | C15: 1555070
A16: =A15+1 -> 40800 | B16: =CHOOSE(WEEKDAY(A16,1),"日","一","二","三","四","五","六") -> 三 | C16: 1593075
A17: =A16+1 -> 40801 | B17: =CHOOSE(WEEKDAY(A17,1),"日","一","二","三","四","五","六") -> 四 | C17: 1598912
A18: =A17+1 -> 40802 | B18: =CHOOSE(WEEKDAY(A18,1),"日","一","二","三","四","五","六") -> 五 | C18: 1749462
A19: =A18+1 -> 40803 | B19: =CHOOSE(WEEKDAY(A19,1),"日","一","二","三","四","五","六") -> 六 | C19: 1631108
A20: =A19+1 -> 40804 | B20: =CHOOSE(WEEKDAY(A20,1),"日","一","二","三","四","五","六") -> 日 | C20: 1328847
A21: =A20+1 -> 40805 | B21: =CHOOSE(WEEKDAY(A21,1),"日","一","二","三","四","五","六") -> 一 | C21: 1562265
A22: =A21+1 -> 40806 | B22: =CHOOSE(WEEKDAY(A22,1),"日","一","二","三","四","五","六") -> 二 | C22: 1557396
A23: =A22+1 -> 40807 | B23: =CHOOSE(WEEKDAY(A23,1),"日","一","二","三","四","五","六") -> 三 | C23: 1572198
A24: =A23+1 -> 40808 | B24: =CHOOSE(WEEKDAY(A24,1),"日","一","二","三","四","五","六") -> 四 | C24: 1573557
A25: =A24+1 -> 40809 | B25: =CHOOSE(WEEKDAY(A25,1),"日","一","二","三","四","五","六") -> 五 | C25: 1748341
A26: =A25+1 -> 40810 | B26: =CHOOSE(WEEKDAY(A26,1),"日","一","二","三","四","五","六") -> 六 | C26: 1616561
A27: =A26+1 -> 40811 | B27: =CHOOSE(WEEKDAY(A27,1),"日","一","二","三","四","五","六") -> 日 | C27: 1311571
A28: =A27+1 -> 40812 | B28: =CHOOSE(WEEKDAY(A28,1),"日","一","二","三","四","五","六") -> 一 | C28: 1523298
A29: =A28+1 -> 40813 | B29: =CHOOSE(WEEKDAY(A29,1),"日","一","二","三","四","五","六") -> 二 | C29: 1550562
A30: =A29+1 -> 40814 | B30: =CHOOSE(WEEKDAY(A30,1),"日","一","二","三","四","五","六") -> 三 | C30: 1582356
A31: =A30+1 -> 40815 | B31: =CHOOSE(WEEKDAY(A31,1),"日","一","二","三","四","五","六") -> 四 | C31: 1585457
A32: =A31+1 -> 40816 | B32: =CHOOSE(WEEKDAY(A32,1),"日","一","二","三","四","五","六") -> 五 | C32: 1744891
A33: 當月總計 | C33: =SUM(C3:C32) -> 46440216
A34: 日平均 | C34: =C33/30 -> 1548007.2
C35: 單位：人次