A1: 臺北捷運公司運量統計表
A2: 營運日 | B2: 星期 | C2: 總 運 量
A3: 40634 | B3: =CHOOSE(WEEKDAY(A3,1),"日","一","二","三","四","五","六") -> 五 | C3: 1769961
A4: =A3+1 -> 40635 | B4: =CHOOSE(WEEKDAY(A4,1),"日","一","二","三","四","五","六") -> 六 | C4: 1540725
A5: =A4+1 -> 40636 | B5: =CHOOSE(WEEKDAY(A5,1),"日","一","二","三","四","五","六") -> 日 | C5: 1407850
A6: =A5+1 -> 40637 | B6: =CHOOSE(WEEKDAY(A6,1),"日","一","二","三","四","五","六") -> 一 | C6: 1249160
A7: =A6+1 -> 40638 | B7: =CHOOSE(WEEKDAY(A7,1),"日","一","二","三","四","五","六") -> 二 | C7: 1084894
A8: =A7+1 -> 40639 | B8: =CHOOSE(WEEKDAY(A8,1),"日","一","二","三","四","五","六") -> 三 | C8: 1599464
A9: =A8+1 -> 40640 | B9: =CHOOSE(WEEKDAY(A9,1),"日","一","二","三","四","五","六") -> 四 | C9: 1613994
A10: =A9+1 -> 40641 | B10: =CHOOSE(WEEKDAY(A10,1),"日","一","二","三","四","五","六") -> 五 | C10: 1751148
A11: =A10+1 -> 40642 | B11: =CHOOSE(WEEKDAY(A11,1),"日","一","二","三","四","五","六") -> 六 | C11: 1636677
A12: =A11+1 -> 40643 | B12: =CHOOSE(WEEKDAY(A12,1),"日","一","二","三","四","五","六") -> 日 | C12: 1394356
A13: =A12+1 -> 40644 | B13: =CHOOSE(WEEKDAY(A13,1),"日","一","二","三","四","五","六") -> 一 | C13: 1548876
A14: =A13+1 -> 40645 | B14: =CHOOSE(WEEKDAY(A14,1),"日","一","二","三","四","五","六") -> 二 | C14: 1573787
A15: =A14+1 -> 40646 | B15: =CHOOSE(WEEKDAY(A15,1),"日","一","二","三","四","五","六") -> 三 | C15: 1598522
A16: =A15+1 -> 40647 | B16: =CHOOSE(WEEKDAY(A16,1),"日","一","二","三","四","五","六") -> 四 | C16: 1609378
A17: =A16+1 -> 40648 | B17: =CHOOSE(WEEKDAY(A17,1),"日","一","二","三","四","五","六") -> 五 | C17: 1753053
A18: =A17+1 -> 40649 | B18: =CHOOSE(WEEKDAY(A18,1),"日","一","二","三","四","五","六") -> 六 | C18: 1616614
A19: =A18+1 -> 40650 | B19: =CHOOSE(WEEKDAY(A19,1),"日","一","二","三","四","五","六") -> 日 | C19: 1287266
A20: =A19+1 -> 40651 | B20: =CHOOSE(WEEKDAY(A20,1),"日","一","二","三","四","五","六") -> 一 | C20: 1555329
A21: =A20+1 -> 40652 | B21: =CHOOSE(WEEKDAY(A21,1),"日","一","二","三","四","五","六") -> 二 | C21: 1600786
A22: =A21+1 -> 40653 | B22: =CHOOSE(WEEKDAY(A22,1),"日","一","二","三","四","五","六") -> 三 | C22: 1644529
A23: =A22+1 -> 40654 | B23: =CHOOSE(WEEKDAY(A23,1),"日","一","二","三","四","五","六") -> 四 | C23: 1657508
A24: =A23+1 -> 40655 | B24: =CHOOSE(WEEKDAY(A24,1),"日","一","二","三","四","五","六") -> 五 | C24: 1831303
A25: =A24+1 -> 40656 | B25: =CHOOSE(WEEKDAY(A25,1),"日","一","二","三","四","五","六") -> 六 | C25: 1713319
A26: =A25+1 -> 40657 | B26: =CHOOSE(WEEKDAY(A26,1),"日","一","二","三","四","五","六") -> 日 | C26: 1545109
A27: =A26+1 -> 40658 | B27: =CHOOSE(WEEKDAY(A27,1),"日","一","二","三","四","五","六") -> 一 | C27: 1612657
A28: =A27+1 -> 40659 | B28: =CHOOSE(WEEKDAY(A28,1),"日","一","二","三","四","五","六") -> 二 | C28: 1533173
A29: =A28+1 -> 40660 | B29: =CHOOSE(WEEKDAY(A29,1),"日","一","二","三","四","五","六") -> 三 | C29: 1564019
A30: =A29+1 -> 40661 | B30: =CHOOSE(WEEKDAY(A30,1),"日","一","二","三","四","五","六") -> 四 | C30: 1574866
A31: =A30+1 -> 40662 | B31: =CHOOSE(WEEKDAY(A31,1),"日","一","二","三","四","五","六") -> 五 | C31: 1733633
A32: =A31+1 -> 40663 | B32: =CHOOSE(WEEKDAY(A32,1),"日","一","二","三","四","五","六") -> 六 | C32: 1603243
A33: 當月總計 | C33: =SUM(C3:C32) -> 47205199
A34: 日平均 | C34: =C33/30 -> 1573506.6333333333
C35: 單位：人次