A1: 臺北捷運公司運量統計表
A2: 營運日 | B2: 星期 | C2: 總 運 量
A3: 40664 | B3: =CHOOSE(WEEKDAY(A3,1),"日","一","二","三","四","五","六") -> 日 | C3: 1377448
A4: =A3+1 -> 40665 | B4: =CHOOSE(WEEKDAY(A4,1),"日","一","二","三","四","五","六") -> 一 | C4: 1382467
A5: =A4+1 -> 40666 | B5: =CHOOSE(WEEKDAY(A5,1),"日","一","二","三","四","五","六") -> 二 | C5: 1505041
A6: =A5+1 -> 40667 | B6: =CHOOSE(WEEKDAY(A6,1),"日","一","二","三","四","五","六") -> 三 | C6: 1541977
A7: =A6+1 -> 40668 | B7: =CHOOSE(WEEKDAY(A7,1),"日","一","二","三","四","五","六") -> 四 | C7: 1565542
A8: =A7+1 -> 40669 | B8: =CHOOSE(WEEKDAY(A8,1),"日","一","二","三","四","五","六") -> 五 | C8: 1726725
A9: =A8+1 -> 40670 | B9: =CHOOSE(WEEKDAY(A9,1),"日","一","二","三","四","五","六") -> 六 | C9: 1468300
A10: =A9+1 -> 40671 | B10: =CHOOSE(WEEKDAY(A10,1),"日","一","二","三","四","五","六") -> 日 | C10: 1178328
A11: =A10+1 -> 40672 | B11: =CHOOSE(WEEKDAY(A11,1),"日","一","二","三","四","五","六") -> 一 | C11: 1489396
A12: =A11+1 -> 40673 | B12: =CHOOSE(WEEKDAY(A12,1),"日","一","二","三","四","五","六") -> 二 | C12: 1487898
A13: =A12+1 -> 40674 | B13: =CHOOSE(WEEKDAY(A13,1),"日","一","二","三","四","五","六") -> 三 | C13: 1500547
A14: =A13+1 -> 40675 | B14: =CHOOSE(WEEKDAY(A14,1),"日","一","二","三","四","五","六") -> 四 | C14: 1507969
A15: =A14+1 -> 40676 | B15: =CHOOSE(WEEKDAY(A15,1),"日","一","二","三","四","五","六") -> 五 | C15: 1704226
A16: =A15+1 -> 40677 | B16: =CHOOSE(WEEKDAY(A16,1),"日","一","二","三","四","五","六") -> 六 | C16: 1480861
A17: =A16+1 -> 40678 | B17: =CHOOSE(WEEKDAY(A17,1),"日","一","二","三","四","五","六") -> 日 | C17: 1317155
A18: =A17+1 -> 40679 | B18: =CHOOSE(WEEKDAY(A18,1),"日","一","二","三","四","五","六") -> 一 | C18: 1495956
A19: =A18+1 -> 40680 | B19: =CHOOSE(WEEKDAY(A19,1),"日","一","二","三","四","五","六") -> 二 | C19: 1533949
A20: =A19+1 -> 40681 | B20: =CHOOSE(WEEKDAY(A20,1),"日","一","二","三","四","五","六") -> 三 | C20: 1552826
A21: =A20+1 -> 40682 | B21: =CHOOSE(WEEKDAY(A21,1),"日","一","二","三","四","五","六") -> 四 | C21: 1567747
A22: =A21+1 -> 40683 | B22: =CHOOSE(WEEKDAY(A22,1),"日","一","二","三","四","五","六") -> 五 | C22: 1772312
A23: =A22+1 -> 40684 | B23: =CHOOSE(WEEKDAY(A23,1),"日","一","二","三","四","五","六") -> 六 | C23: 1634114
A24: =A23+1 -> 40685 | B24: =CHOOSE(WEEKDAY(A24,1),"日","一","二","三","四","五","六") -> 日 | C24: 1345555
A25: =A24+1 -> 40686 | B25: =CHOOSE(WEEKDAY(A25,1),"日","一","二","三","四","五","六") -> 一 | C25: 1505566
A26: =A25+1 -> 40687 | B26: =CHOOSE(WEEKDAY(A26,1),"日","一","二","三","四","五","六") -> 二 | C26: 1512452
A27: =A26+1 -> 40688 | B27: =CHOOSE(WEEKDAY(A27,1),"日","一","二","三","四","五","六") -> 三 | C27: 1528356
A28: =A27+1 -> 40689 | B28: =CHOOSE(WEEKDAY(A28,1),"日","一","二","三","四","五","六") -> 四 | C28: 1533646
A29: =A28+1 -> 40690 | B29: =CHOOSE(WEEKDAY(A29,1),"日","一","二","三","四","五","六") -> 五 | C29: 1642571
A30: =A29+1 -> 40691 | B30: =CHOOSE(WEEKDAY(A30,1),"日","一","二","三","四","五","六") -> 六 | C30: 1408626
A31: =A30+1 -> 40692 | B31: =CHOOSE(WEEKDAY(A31,1),"日","一","二","三","四","五","六") -> 日 | C31: 1362859
A32: =A31+1 -> 40693 | B32: =CHOOSE(WEEKDAY(A32,1),"日","一","二","三","四","五","六") -> 一 | C32: 1497313
A33: =A32+1 -> 40694 | B33: =CHOOSE(WEEKDAY(A33,1),"日","一","二","三","四","五","六") -> 二 | C33: 1525608
A34: 當月總計 | C34: =SUM(C3:C33) -> 46653336
A35: 日平均 | C35: =C34/31 -> 1504946.3225806451
C36: 單位：人次