A1: 臺北捷運公司運量統計表
A2: 營運日 | B2: 星期 | C2: 總 運 量
A3: 40756 | B3: =CHOOSE(WEEKDAY(A3,1),"日","一","二","三","四","五","六") -> 一 | C3: 1545583
A4: =A3+1 -> 40757 | B4: =CHOOSE(WEEKDAY(A4,1),"日","一","二","三","四","五","六") -> 二 | C4: 1569507
A5: =A4+1 -> 40758 | B5: =CHOOSE(WEEKDAY(A5,1),"日","一","二","三","四","五","六") -> 三 | C5: 1591793
A6: =A5+1 -> 40759 | B6: =CHOOSE(WEEKDAY(A6,1),"日","一","二","三","四","五","六") -> 四 | C6: 1582118
A7: =A6+1 -> 40760 | B7: =CHOOSE(WEEKDAY(A7,1),"日","一","二","三","四","五","六") -> 五 | C7: 1663563
A8: =A7+1 -> 40761 | B8: =CHOOSE(WEEKDAY(A8,1),"日","一","二","三","四","五","六") -> 六 | C8: 1424218
A9: =A8+1 -> 40762 | B9: =CHOOSE(WEEKDAY(A9,1),"日","一","二","三","四","五","六") -> 日 | C9: 1195891
A10: =A9+1 -> 40763 | B10: =CHOOSE(WEEKDAY(A10,1),"日","一","二","三","四","五","六") -> 一 | C10: 1491418
A11: =A10+1 -> 40764 | B11: =CHOOSE(WEEKDAY(A11,1),"日","一","二","三","四","五","六") -> 二 | C11: 1581017
A12: =A11+1 -> 40765 | B12: =CHOOSE(WEEKDAY(A12,1),"日","一","二","三","四","五","六") -> 三 | C12: 1601119
A13: =A12+1 -> 40766 | B13: =CHOOSE(WEEKDAY(A13,1),"日","一","二","三","四","五","六") -> 四 | C13: 1634859
A14: =A13+1 -> 40767 | B14: =CHOOSE(WEEKDAY(A14,1),"日","一","二","三","四","五","六") -> 五 | C14: 1742343
A15: =A14+1 -> 40768 | B15: =CHOOSE(WEEKDAY(A15,1),"日","一","二","三","四","五","六") -> 六 | C15: 1568768
A16: =A15+1 -> 40769 | B16: =CHOOSE(WEEKDAY(A16,1),"日","一","二","三","四","五","六") -> 日 | C16: 1244501
A17: =A16+1 -> 40770 | B17: =CHOOSE(WEEKDAY(A17,1),"日","一","二","三","四","五","六") -> 一 | C17: 1593262
A18: =A17+1 -> 40771 | B18: =CHOOSE(WEEKDAY(A18,1),"日","一","二","三","四","五","六") -> 二 | C18: 1635563
A19: =A18+1 -> 40772 | B19: =CHOOSE(WEEKDAY(A19,1),"日","一","二","三","四","五","六") -> 三 | C19: 1632962
A20: =A19+1 -> 40773 | B20: =CHOOSE(WEEKDAY(A20,1),"日","一","二","三","四","五","六") -> 四 | C20: 1636587
A21: =A20+1 -> 40774 | B21: =CHOOSE(WEEKDAY(A21,1),"日","一","二","三","四","五","六") -> 五 | C21: 1755602
A22: =A21+1 -> 40775 | B22: =CHOOSE(WEEKDAY(A22,1),"日","一","二","三","四","五","六") -> 六 | C22: 1589394
A23: =A22+1 -> 40776 | B23: =CHOOSE(WEEKDAY(A23,1),"日","一","二","三","四","五","六") -> 日 | C23: 1348221
A24: =A23+1 -> 40777 | B24: =CHOOSE(WEEKDAY(A24,1),"日","一","二","三","四","五","六") -> 一 | C24: 1570291
A25: =A24+1 -> 40778 | B25: =CHOOSE(WEEKDAY(A25,1),"日","一","二","三","四","五","六") -> 二 | C25: 1602847
A26: =A25+1 -> 40779 | B26: =CHOOSE(WEEKDAY(A26,1),"日","一","二","三","四","五","六") -> 三 | C26: 1626343
A27: =A26+1 -> 40780 | B27: =CHOOSE(WEEKDAY(A27,1),"日","一","二","三","四","五","六") -> 四 | C27: 1651370
A28: =A27+1 -> 40781 | B28: =CHOOSE(WEEKDAY(A28,1),"日","一","二","三","四","五","六") -> 五 | C28: 1725050
A29: =A28+1 -> 40782 | B29: =CHOOSE(WEEKDAY(A29,1),"日","一","二","三","四","五","六") -> 六 | C29: 1489758
A30: =A29+1 -> 40783 | B30: =CHOOSE(WEEKDAY(A30,1),"日","一","二","三","四","五","六") -> 日 | C30: 1119062
A31: =A30+1 -> 40784 | B31: =CHOOSE(WEEKDAY(A31,1),"日","一","二","三","四","五","六") -> 一 | C31: 1318743
A32: =A31+1 -> 40785 | B32: =CHOOSE(WEEKDAY(A32,1),"日","一","二","三","四","五","六") -> 二 | C32: 1507848
A33: =A32+1 -> 40786 | B33: =CHOOSE(WEEKDAY(A33,1),"日","一","二","三","四","五","六") -> 三 | C33: 1566570
A34: 當月總計 | C34: =SUM(C3:C33) -> 47806171
A35: 日平均 | C35: =C34/31 -> 1542134.5483870967
C36: 單位：人次