A1: 臺北捷運公司運量統計表
A2: 營運日 | B2: 星期 | C2: 總 運 量
A3: 40848 | B3: =CHOOSE(WEEKDAY(A3,1),"日","一","二","三","四","五","六") -> 二 | C3: 1523983
A4: =A3+1 -> 40849 | B4: =CHOOSE(WEEKDAY(A4,1),"日","一","二","三","四","五","六") -> 三 | C4: 1550346
A5: =A4+1 -> 40850 | B5: =CHOOSE(WEEKDAY(A5,1),"日","一","二","三","四","五","六") -> 四 | C5: 1549716
A6: =A5+1 -> 40851 | B6: =CHOOSE(WEEKDAY(A6,1),"日","一","二","三","四","五","六") -> 五 | C6: 1713424
A7: =A6+1 -> 40852 | B7: =CHOOSE(WEEKDAY(A7,1),"日","一","二","三","四","五","六") -> 六 | C7: 1577096
A8: =A7+1 -> 40853 | B8: =CHOOSE(WEEKDAY(A8,1),"日","一","二","三","四","五","六") -> 日 | C8: 1295147
A9: =A8+1 -> 40854 | B9: =CHOOSE(WEEKDAY(A9,1),"日","一","二","三","四","五","六") -> 一 | C9: 1533555
A10: =A9+1 -> 40855 | B10: =CHOOSE(WEEKDAY(A10,1),"日","一","二","三","四","五","六") -> 二 | C10: 1566939
A11: =A10+1 -> 40856 | B11: =CHOOSE(WEEKDAY(A11,1),"日","一","二","三","四","五","六") -> 三 | C11: 1576621
A12: =A11+1 -> 40857 | B12: =CHOOSE(WEEKDAY(A12,1),"日","一","二","三","四","五","六") -> 四 | C12: 1648238
A13: =A12+1 -> 40858 | B13: =CHOOSE(WEEKDAY(A13,1),"日","一","二","三","四","五","六") -> 五 | C13: 1853461
A14: =A13+1 -> 40859 | B14: =CHOOSE(WEEKDAY(A14,1),"日","一","二","三","四","五","六") -> 六 | C14: 1700035
A15: =A14+1 -> 40860 | B15: =CHOOSE(WEEKDAY(A15,1),"日","一","二","三","四","五","六") -> 日 | C15: 1429919
A16: =A15+1 -> 40861 | B16: =CHOOSE(WEEKDAY(A16,1),"日","一","二","三","四","五","六") -> 一 | C16: 1614245
A17: =A16+1 -> 40862 | B17: =CHOOSE(WEEKDAY(A17,1),"日","一","二","三","四","五","六") -> 二 | C17: 1606023
A18: =A17+1 -> 40863 | B18: =CHOOSE(WEEKDAY(A18,1),"日","一","二","三","四","五","六") -> 三 | C18: 1638784
A19: =A18+1 -> 40864 | B19: =CHOOSE(WEEKDAY(A19,1),"日","一","二","三","四","五","六") -> 四 | C19: 1626776
A20: =A19+1 -> 40865 | B20: =CHOOSE(WEEKDAY(A20,1),"日","一","二","三","四","五","六") -> 五 | C20: 1803900
A21: =A20+1 -> 40866 | B21: =CHOOSE(WEEKDAY(A21,1),"日","一","二","三","四","五","六") -> 六 | C21: 1554614
A22: =A21+1 -> 40867 | B22: =CHOOSE(WEEKDAY(A22,1),"日","一","二","三","四","五","六") -> 日 | C22: 1404829
A23: =A22+1 -> 40868 | B23: =CHOOSE(WEEKDAY(A23,1),"日","一","二","三","四","五","六") -> 一 | C23: 1590604
A24: =A23+1 -> 40869 | B24: =CHOOSE(WEEKDAY(A24,1),"日","一","二","三","四","五","六") -> 二 | C24: 1575750
A25: =A24+1 -> 40870 | B25: =CHOOSE(WEEKDAY(A25,1),"日","一","二","三","四","五","六") -> 三 | C25: 1596366
A26: =A25+1 -> 40871 | B26: =CHOOSE(WEEKDAY(A26,1),"日","一","二","三","四","五","六") -> 四 | C26: 1627253
A27: =A26+1 -> 40872 | B27: =CHOOSE(WEEKDAY(A27,1),"日","一","二","三","四","五","六") -> 五 | C27: 1798919
A28: =A27+1 -> 40873 | B28: =CHOOSE(WEEKDAY(A28,1),"日","一","二","三","四","五","六") -> 六 | C28: 1613693
A29: =A28+1 -> 40874 | B29: =CHOOSE(WEEKDAY(A29,1),"日","一","二","三","四","五","六") -> 日 | C29: 1353521
A30: =A29+1 -> 40875 | B30: =CHOOSE(WEEKDAY(A30,1),"日","一","二","三","四","五","六") -> 一 | C30: 1553498
A31: =A30+1 -> 40876 | B31: =CHOOSE(WEEKDAY(A31,1),"日","一","二","三","四","五","六") -> 二 | C31: 1560986
A32: =A31+1 -> 40877 | B32: =CHOOSE(WEEKDAY(A32,1),"日","一","二","三","四","五","六") -> 三 | C32: 1598968
A33: 當月總計 | C33: =SUM(C3:C32) -> 47637209
A34: 日平均 | C34: =C33/30 -> 1587906.9666666666
C35: 單位：人次