A1: 臺北捷運公司運量統計表
A2: 營運日 | B2: 星期 | C2: 總 運 量
A3: 41030 | B3: =CHOOSE(WEEKDAY(A3,1),"日","一","二","三","四","五","六") -> 二 | C3: 1486960
A4: =A3+1 -> 41031 | B4: =CHOOSE(WEEKDAY(A4,1),"日","一","二","三","四","五","六") -> 三 | C4: 1627454
A5: =A4+1 -> 41032 | B5: =CHOOSE(WEEKDAY(A5,1),"日","一","二","三","四","五","六") -> 四 | C5: 1654144
A6: =A5+1 -> 41033 | B6: =CHOOSE(WEEKDAY(A6,1),"日","一","二","三","四","五","六") -> 五 | C6: 1809577
A7: =A6+1 -> 41034 | B7: =CHOOSE(WEEKDAY(A7,1),"日","一","二","三","四","五","六") -> 六 | C7: 1642354
A8: =A7+1 -> 41035 | B8: =CHOOSE(WEEKDAY(A8,1),"日","一","二","三","四","五","六") -> 日 | C8: 1406266
A9: =A8+1 -> 41036 | B9: =CHOOSE(WEEKDAY(A9,1),"日","一","二","三","四","五","六") -> 一 | C9: 1604415
A10: =A9+1 -> 41037 | B10: =CHOOSE(WEEKDAY(A10,1),"日","一","二","三","四","五","六") -> 二 | C10: 1620082
A11: =A10+1 -> 41038 | B11: =CHOOSE(WEEKDAY(A11,1),"日","一","二","三","四","五","六") -> 三 | C11: 1641728
A12: =A11+1 -> 41039 | B12: =CHOOSE(WEEKDAY(A12,1),"日","一","二","三","四","五","六") -> 四 | C12: 1674056
A13: =A12+1 -> 41040 | B13: =CHOOSE(WEEKDAY(A13,1),"日","一","二","三","四","五","六") -> 五 | C13: 1864522
A14: =A13+1 -> 41041 | B14: =CHOOSE(WEEKDAY(A14,1),"日","一","二","三","四","五","六") -> 六 | C14: 1586243
A15: =A14+1 -> 41042 | B15: =CHOOSE(WEEKDAY(A15,1),"日","一","二","三","四","五","六") -> 日 | C15: 1296843
A16: =A15+1 -> 41043 | B16: =CHOOSE(WEEKDAY(A16,1),"日","一","二","三","四","五","六") -> 一 | C16: 1600279
A17: =A16+1 -> 41044 | B17: =CHOOSE(WEEKDAY(A17,1),"日","一","二","三","四","五","六") -> 二 | C17: 1613020
A18: =A17+1 -> 41045 | B18: =CHOOSE(WEEKDAY(A18,1),"日","一","二","三","四","五","六") -> 三 | C18: 1625987
A19: =A18+1 -> 41046 | B19: =CHOOSE(WEEKDAY(A19,1),"日","一","二","三","四","五","六") -> 四 | C19: 1640160
A20: =A19+1 -> 41047 | B20: =CHOOSE(WEEKDAY(A20,1),"日","一","二","三","四","五","六") -> 五 | C20: 1850259
A21: =A20+1 -> 41048 | B21: =CHOOSE(WEEKDAY(A21,1),"日","一","二","三","四","五","六") -> 六 | C21: 1776374
A22: =A21+1 -> 41049 | B22: =CHOOSE(WEEKDAY(A22,1),"日","一","二","三","四","五","六") -> 日 | C22: 1350402
A23: =A22+1 -> 41050 | B23: =CHOOSE(WEEKDAY(A23,1),"日","一","二","三","四","五","六") -> 一 | C23: 1607749
A24: =A23+1 -> 41051 | B24: =CHOOSE(WEEKDAY(A24,1),"日","一","二","三","四","五","六") -> 二 | C24: 1614705
A25: =A24+1 -> 41052 | B25: =CHOOSE(WEEKDAY(A25,1),"日","一","二","三","四","五","六") -> 三 | C25: 1627598
A26: =A25+1 -> 41053 | B26: =CHOOSE(WEEKDAY(A26,1),"日","一","二","三","四","五","六") -> 四 | C26: 1628875
A27: =A26+1 -> 41054 | B27: =CHOOSE(WEEKDAY(A27,1),"日","一","二","三","四","五","六") -> 五 | C27: 1805300
A28: =A27+1 -> 41055 | B28: =CHOOSE(WEEKDAY(A28,1),"日","一","二","三","四","五","六") -> 六 | C28: 1658194
A29: =A28+1 -> 41056 | B29: =CHOOSE(WEEKDAY(A29,1),"日","一","二","三","四","五","六") -> 日 | C29: 1362150
A30: =A29+1 -> 41057 | B30: =CHOOSE(WEEKDAY(A30,1),"日","一","二","三","四","五","六") -> 一 | C30: 1608516
A31: =A30+1 -> 41058 | B31: =CHOOSE(WEEKDAY(A31,1),"日","一","二","三","四","五","六") -> 二 | C31: 1607092
A32: =A31+1 -> 41059 | B32: =CHOOSE(WEEKDAY(A32,1),"日","一","二","三","四","五","六") -> 三 | C32: 1620717
A33: =A32+1 -> 41060 | B33: =CHOOSE(WEEKDAY(A33,1),"日","一","二","三","四","五","六") -> 四 | C33: 1619108
A34: 當月總計 | C34: =SUM(C3:C33) -> 50131129
A35: 日平均 | C35: =C34/31 -> 1617133.1935483871
C36: 單位：人次