A1: 臺北捷運公司運量統計表
A2: 營運日 | B2: 星期 | C2: 總 運 量
A3: 41153 | B3: =CHOOSE(WEEKDAY(A3,1),"日","一","二","三","四","五","六") -> 六 | C3: 1556794
A4: =A3+1 -> 41154 | B4: =CHOOSE(WEEKDAY(A4,1),"日","一","二","三","四","五","六") -> 日 | C4: 1307178
A5: =A4+1 -> 41155 | B5: =CHOOSE(WEEKDAY(A5,1),"日","一","二","三","四","五","六") -> 一 | C5: 1630336
A6: =A5+1 -> 41156 | B6: =CHOOSE(WEEKDAY(A6,1),"日","一","二","三","四","五","六") -> 二 | C6: 1651629
A7: =A6+1 -> 41157 | B7: =CHOOSE(WEEKDAY(A7,1),"日","一","二","三","四","五","六") -> 三 | C7: 1686628
A8: =A7+1 -> 41158 | B8: =CHOOSE(WEEKDAY(A8,1),"日","一","二","三","四","五","六") -> 四 | C8: 1686923
A9: =A8+1 -> 41159 | B9: =CHOOSE(WEEKDAY(A9,1),"日","一","二","三","四","五","六") -> 五 | C9: 1814263
A10: =A9+1 -> 41160 | B10: =CHOOSE(WEEKDAY(A10,1),"日","一","二","三","四","五","六") -> 六 | C10: 1632359
A11: =A10+1 -> 41161 | B11: =CHOOSE(WEEKDAY(A11,1),"日","一","二","三","四","五","六") -> 日 | C11: 1369673
A12: =A11+1 -> 41162 | B12: =CHOOSE(WEEKDAY(A12,1),"日","一","二","三","四","五","六") -> 一 | C12: 1654221
A13: =A12+1 -> 41163 | B13: =CHOOSE(WEEKDAY(A13,1),"日","一","二","三","四","五","六") -> 二 | C13: 1671012
A14: =A13+1 -> 41164 | B14: =CHOOSE(WEEKDAY(A14,1),"日","一","二","三","四","五","六") -> 三 | C14: 1694150
A15: =A14+1 -> 41165 | B15: =CHOOSE(WEEKDAY(A15,1),"日","一","二","三","四","五","六") -> 四 | C15: 1684604
A16: =A15+1 -> 41166 | B16: =CHOOSE(WEEKDAY(A16,1),"日","一","二","三","四","五","六") -> 五 | C16: 1806856
A17: =A16+1 -> 41167 | B17: =CHOOSE(WEEKDAY(A17,1),"日","一","二","三","四","五","六") -> 六 | C17: 1533784
A18: =A17+1 -> 41168 | B18: =CHOOSE(WEEKDAY(A18,1),"日","一","二","三","四","五","六") -> 日 | C18: 1381447
A19: =A18+1 -> 41169 | B19: =CHOOSE(WEEKDAY(A19,1),"日","一","二","三","四","五","六") -> 一 | C19: 1655933
A20: =A19+1 -> 41170 | B20: =CHOOSE(WEEKDAY(A20,1),"日","一","二","三","四","五","六") -> 二 | C20: 1674705
A21: =A20+1 -> 41171 | B21: =CHOOSE(WEEKDAY(A21,1),"日","一","二","三","四","五","六") -> 三 | C21: 1704377
A22: =A21+1 -> 41172 | B22: =CHOOSE(WEEKDAY(A22,1),"日","一","二","三","四","五","六") -> 四 | C22: 1705507
A23: =A22+1 -> 41173 | B23: =CHOOSE(WEEKDAY(A23,1),"日","一","二","三","四","五","六") -> 五 | C23: 1871210
A24: =A23+1 -> 41174 | B24: =CHOOSE(WEEKDAY(A24,1),"日","一","二","三","四","五","六") -> 六 | C24: 1716829
A25: =A24+1 -> 41175 | B25: =CHOOSE(WEEKDAY(A25,1),"日","一","二","三","四","五","六") -> 日 | C25: 1410097
A26: =A25+1 -> 41176 | B26: =CHOOSE(WEEKDAY(A26,1),"日","一","二","三","四","五","六") -> 一 | C26: 1637404
A27: =A26+1 -> 41177 | B27: =CHOOSE(WEEKDAY(A27,1),"日","一","二","三","四","五","六") -> 二 | C27: 1681562
A28: =A27+1 -> 41178 | B28: =CHOOSE(WEEKDAY(A28,1),"日","一","二","三","四","五","六") -> 三 | C28: 1710326
A29: =A28+1 -> 41179 | B29: =CHOOSE(WEEKDAY(A29,1),"日","一","二","三","四","五","六") -> 四 | C29: 1700923
A30: =A29+1 -> 41180 | B30: =CHOOSE(WEEKDAY(A30,1),"日","一","二","三","四","五","六") -> 五 | C30: 1841120
A31: =A30+1 -> 41181 | B31: =CHOOSE(WEEKDAY(A31,1),"日","一","二","三","四","五","六") -> 六 | C31: 1452404
A32: =A31+1 -> 41182 | B32: =CHOOSE(WEEKDAY(A32,1),"日","一","二","三","四","五","六") -> 日 | C32: 1271370
A34: 當月總計 | C34: =SUM(C3:C33) -> 48795624
A35: 日平均 | C35: =C34/30 -> 1626520.8
C36: 單位：人次