A1: 臺北捷運公司運量統計表
A2: 營運日 | B2: 星期 | C2: 總 運 量
A3: 40909 | B3: =CHOOSE(WEEKDAY(A3,1),"日","一","二","三","四","五","六") -> 日 | C3: 1265122
A4: =A3+1 -> 40910 | B4: =CHOOSE(WEEKDAY(A4,1),"日","一","二","三","四","五","六") -> 一 | C4: 1552255
A5: =A4+1 -> 40911 | B5: =CHOOSE(WEEKDAY(A5,1),"日","一","二","三","四","五","六") -> 二 | C5: 1566982
A6: =A5+1 -> 40912 | B6: =CHOOSE(WEEKDAY(A6,1),"日","一","二","三","四","五","六") -> 三 | C6: 1581600
A7: =A6+1 -> 40913 | B7: =CHOOSE(WEEKDAY(A7,1),"日","一","二","三","四","五","六") -> 四 | C7: 1674320
A8: =A7+1 -> 40914 | B8: =CHOOSE(WEEKDAY(A8,1),"日","一","二","三","四","五","六") -> 五 | C8: 1876353
A9: =A8+1 -> 40915 | B9: =CHOOSE(WEEKDAY(A9,1),"日","一","二","三","四","五","六") -> 六 | C9: 1635411
A10: =A9+1 -> 40916 | B10: =CHOOSE(WEEKDAY(A10,1),"日","一","二","三","四","五","六") -> 日 | C10: 1383264
A11: =A10+1 -> 40917 | B11: =CHOOSE(WEEKDAY(A11,1),"日","一","二","三","四","五","六") -> 一 | C11: 1615969
A12: =A11+1 -> 40918 | B12: =CHOOSE(WEEKDAY(A12,1),"日","一","二","三","四","五","六") -> 二 | C12: 1648209
A13: =A12+1 -> 40919 | B13: =CHOOSE(WEEKDAY(A13,1),"日","一","二","三","四","五","六") -> 三 | C13: 1669140
A14: =A13+1 -> 40920 | B14: =CHOOSE(WEEKDAY(A14,1),"日","一","二","三","四","五","六") -> 四 | C14: 1705551
A15: =A14+1 -> 40921 | B15: =CHOOSE(WEEKDAY(A15,1),"日","一","二","三","四","五","六") -> 五 | C15: 1941644
A16: =A15+1 -> 40922 | B16: =CHOOSE(WEEKDAY(A16,1),"日","一","二","三","四","五","六") -> 六 | C16: 1518673
A17: =A16+1 -> 40923 | B17: =CHOOSE(WEEKDAY(A17,1),"日","一","二","三","四","五","六") -> 日 | C17: 1368459
A18: =A17+1 -> 40924 | B18: =CHOOSE(WEEKDAY(A18,1),"日","一","二","三","四","五","六") -> 一 | C18: 1759703
A19: =A18+1 -> 40925 | B19: =CHOOSE(WEEKDAY(A19,1),"日","一","二","三","四","五","六") -> 二 | C19: 1822462
A20: =A19+1 -> 40926 | B20: =CHOOSE(WEEKDAY(A20,1),"日","一","二","三","四","五","六") -> 三 | C20: 1841918
A21: =A20+1 -> 40927 | B21: =CHOOSE(WEEKDAY(A21,1),"日","一","二","三","四","五","六") -> 四 | C21: 1775902
A22: =A21+1 -> 40928 | B22: =CHOOSE(WEEKDAY(A22,1),"日","一","二","三","四","五","六") -> 五 | C22: 1728153
A23: =A22+1 -> 40929 | B23: =CHOOSE(WEEKDAY(A23,1),"日","一","二","三","四","五","六") -> 六 | C23: 1044600
A24: =A23+1 -> 40930 | B24: =CHOOSE(WEEKDAY(A24,1),"日","一","二","三","四","五","六") -> 日 | C24: 553099
A25: =A24+1 -> 40931 | B25: =CHOOSE(WEEKDAY(A25,1),"日","一","二","三","四","五","六") -> 一 | C25: 1017719
A26: =A25+1 -> 40932 | B26: =CHOOSE(WEEKDAY(A26,1),"日","一","二","三","四","五","六") -> 二 | C26: 936131
A27: =A26+1 -> 40933 | B27: =CHOOSE(WEEKDAY(A27,1),"日","一","二","三","四","五","六") -> 三 | C27: 1246885
A28: =A27+1 -> 40934 | B28: =CHOOSE(WEEKDAY(A28,1),"日","一","二","三","四","五","六") -> 四 | C28: 1335047
A29: =A28+1 -> 40935 | B29: =CHOOSE(WEEKDAY(A29,1),"日","一","二","三","四","五","六") -> 五 | C29: 1629629
A30: =A29+1 -> 40936 | B30: =CHOOSE(WEEKDAY(A30,1),"日","一","二","三","四","五","六") -> 六 | C30: 1609206
A31: =A30+1 -> 40937 | B31: =CHOOSE(WEEKDAY(A31,1),"日","一","二","三","四","五","六") -> 日 | C31: 1310268
A32: =A31+1 -> 40938 | B32: =CHOOSE(WEEKDAY(A32,1),"日","一","二","三","四","五","六") -> 一 | C32: 1619820
A33: =A32+1 -> 40939 | B33: =CHOOSE(WEEKDAY(A33,1),"日","一","二","三","四","五","六") -> 二 | C33: 1677030
A34: 當月總計 | C34: =SUM(C3:C33) -> 46910524
A35: 日平均 | C35: =C34/31 -> 1513242.7096774194
C36: 單位：人次