A1: 臺北捷運公司運量統計表
A2: 營運日 | B2: 星期 | C2: 總 運 量
A3: 40940 | B3: =CHOOSE(WEEKDAY(A3,1),"日","一","二","三","四","五","六") -> 三 | C3: 1716053
A4: =A3+1 -> 40941 | B4: =CHOOSE(WEEKDAY(A4,1),"日","一","二","三","四","五","六") -> 四 | C4: 1764635
A5: =A4+1 -> 40942 | B5: =CHOOSE(WEEKDAY(A5,1),"日","一","二","三","四","五","六") -> 五 | C5: 1833943
A6: =A5+1 -> 40943 | B6: =CHOOSE(WEEKDAY(A6,1),"日","一","二","三","四","五","六") -> 六 | C6: 2058072
A7: =A6+1 -> 40944 | B7: =CHOOSE(WEEKDAY(A7,1),"日","一","二","三","四","五","六") -> 日 | C7: 1705764
A8: =A7+1 -> 40945 | B8: =CHOOSE(WEEKDAY(A8,1),"日","一","二","三","四","五","六") -> 一 | C8: 1802236
A9: =A8+1 -> 40946 | B9: =CHOOSE(WEEKDAY(A9,1),"日","一","二","三","四","五","六") -> 二 | C9: 1655212
A10: =A9+1 -> 40947 | B10: =CHOOSE(WEEKDAY(A10,1),"日","一","二","三","四","五","六") -> 三 | C10: 1661087
A11: =A10+1 -> 40948 | B11: =CHOOSE(WEEKDAY(A11,1),"日","一","二","三","四","五","六") -> 四 | C11: 1661395
A12: =A11+1 -> 40949 | B12: =CHOOSE(WEEKDAY(A12,1),"日","一","二","三","四","五","六") -> 五 | C12: 1820529
A13: =A12+1 -> 40950 | B13: =CHOOSE(WEEKDAY(A13,1),"日","一","二","三","四","五","六") -> 六 | C13: 1740062
A14: =A13+1 -> 40951 | B14: =CHOOSE(WEEKDAY(A14,1),"日","一","二","三","四","五","六") -> 日 | C14: 1528054
A15: =A14+1 -> 40952 | B15: =CHOOSE(WEEKDAY(A15,1),"日","一","二","三","四","五","六") -> 一 | C15: 1672367
A16: =A15+1 -> 40953 | B16: =CHOOSE(WEEKDAY(A16,1),"日","一","二","三","四","五","六") -> 二 | C16: 1722964
A17: =A16+1 -> 40954 | B17: =CHOOSE(WEEKDAY(A17,1),"日","一","二","三","四","五","六") -> 三 | C17: 1673735
A18: =A17+1 -> 40955 | B18: =CHOOSE(WEEKDAY(A18,1),"日","一","二","三","四","五","六") -> 四 | C18: 1662238
A19: =A18+1 -> 40956 | B19: =CHOOSE(WEEKDAY(A19,1),"日","一","二","三","四","五","六") -> 五 | C19: 1801522
A20: =A19+1 -> 40957 | B20: =CHOOSE(WEEKDAY(A20,1),"日","一","二","三","四","五","六") -> 六 | C20: 1606031
A21: =A20+1 -> 40958 | B21: =CHOOSE(WEEKDAY(A21,1),"日","一","二","三","四","五","六") -> 日 | C21: 1336631
A22: =A21+1 -> 40959 | B22: =CHOOSE(WEEKDAY(A22,1),"日","一","二","三","四","五","六") -> 一 | C22: 1613515
A23: =A22+1 -> 40960 | B23: =CHOOSE(WEEKDAY(A23,1),"日","一","二","三","四","五","六") -> 二 | C23: 1642194
A24: =A23+1 -> 40961 | B24: =CHOOSE(WEEKDAY(A24,1),"日","一","二","三","四","五","六") -> 三 | C24: 1672805
A25: =A24+1 -> 40962 | B25: =CHOOSE(WEEKDAY(A25,1),"日","一","二","三","四","五","六") -> 四 | C25: 1656523
A26: =A25+1 -> 40963 | B26: =CHOOSE(WEEKDAY(A26,1),"日","一","二","三","四","五","六") -> 五 | C26: 1855297
A27: =A26+1 -> 40964 | B27: =CHOOSE(WEEKDAY(A27,1),"日","一","二","三","四","五","六") -> 六 | C27: 1536822
A28: =A27+1 -> 40965 | B28: =CHOOSE(WEEKDAY(A28,1),"日","一","二","三","四","五","六") -> 日 | C28: 1434495
A29: =A28+1 -> 40966 | B29: =CHOOSE(WEEKDAY(A29,1),"日","一","二","三","四","五","六") -> 一 | C29: 1501172
A30: =A29+1 -> 40967 | B30: =CHOOSE(WEEKDAY(A30,1),"日","一","二","三","四","五","六") -> 二 | C30: 1240407
A31: =A30+1 -> 40968 | B31: =CHOOSE(WEEKDAY(A31,1),"日","一","二","三","四","五","六") -> 三 | C31: 1646507
A34: 當月總計 | C34: =SUM(C3:C33) -> 48222267
A35: 日平均 | C35: =C34/29 -> 1662836.7931034483
C36: 單位：人次