A1: 臺北捷運公司運量統計表
A2: 營運日 | B2: 星期 | C2: 總 運 量
A3: 41365 | B3: =CHOOSE(WEEKDAY(A3,1),"日","一","二","三","四","五","六") -> 一 | C3: 1750922
A4: =A3+1 -> 41366 | B4: =CHOOSE(WEEKDAY(A4,1),"日","一","二","三","四","五","六") -> 二 | C4: 1784274
A5: =A4+1 -> 41367 | B5: =CHOOSE(WEEKDAY(A5,1),"日","一","二","三","四","五","六") -> 三 | C5: 1900403
A6: =A5+1 -> 41368 | B6: =CHOOSE(WEEKDAY(A6,1),"日","一","二","三","四","五","六") -> 四 | C6: 1299890
A7: =A6+1 -> 41369 | B7: =CHOOSE(WEEKDAY(A7,1),"日","一","二","三","四","五","六") -> 五 | C7: 1337680
A8: =A7+1 -> 41370 | B8: =CHOOSE(WEEKDAY(A8,1),"日","一","二","三","四","五","六") -> 六 | C8: 1435312
A9: =A8+1 -> 41371 | B9: =CHOOSE(WEEKDAY(A9,1),"日","一","二","三","四","五","六") -> 日 | C9: 1446054
A10: =A9+1 -> 41372 | B10: =CHOOSE(WEEKDAY(A10,1),"日","一","二","三","四","五","六") -> 一 | C10: 1682442
A11: =A10+1 -> 41373 | B11: =CHOOSE(WEEKDAY(A11,1),"日","一","二","三","四","五","六") -> 二 | C11: 1739489
A12: =A11+1 -> 41374 | B12: =CHOOSE(WEEKDAY(A12,1),"日","一","二","三","四","五","六") -> 三 | C12: 1757287
A13: =A12+1 -> 41375 | B13: =CHOOSE(WEEKDAY(A13,1),"日","一","二","三","四","五","六") -> 四 | C13: 1764385
A14: =A13+1 -> 41376 | B14: =CHOOSE(WEEKDAY(A14,1),"日","一","二","三","四","五","六") -> 五 | C14: 1924107
A15: =A14+1 -> 41377 | B15: =CHOOSE(WEEKDAY(A15,1),"日","一","二","三","四","五","六") -> 六 | C15: 1666700
A16: =A15+1 -> 41378 | B16: =CHOOSE(WEEKDAY(A16,1),"日","一","二","三","四","五","六") -> 日 | C16: 1317237
A17: =A16+1 -> 41379 | B17: =CHOOSE(WEEKDAY(A17,1),"日","一","二","三","四","五","六") -> 一 | C17: 1690178
A18: =A17+1 -> 41380 | B18: =CHOOSE(WEEKDAY(A18,1),"日","一","二","三","四","五","六") -> 二 | C18: 1708095
A19: =A18+1 -> 41381 | B19: =CHOOSE(WEEKDAY(A19,1),"日","一","二","三","四","五","六") -> 三 | C19: 1729902
A20: =A19+1 -> 41382 | B20: =CHOOSE(WEEKDAY(A20,1),"日","一","二","三","四","五","六") -> 四 | C20: 1729987
A21: =A20+1 -> 41383 | B21: =CHOOSE(WEEKDAY(A21,1),"日","一","二","三","四","五","六") -> 五 | C21: 1945207
A22: =A21+1 -> 41384 | B22: =CHOOSE(WEEKDAY(A22,1),"日","一","二","三","四","五","六") -> 六 | C22: 1682226
A23: =A22+1 -> 41385 | B23: =CHOOSE(WEEKDAY(A23,1),"日","一","二","三","四","五","六") -> 日 | C23: 1454909
A24: =A23+1 -> 41386 | B24: =CHOOSE(WEEKDAY(A24,1),"日","一","二","三","四","五","六") -> 一 | C24: 1683324
A25: =A24+1 -> 41387 | B25: =CHOOSE(WEEKDAY(A25,1),"日","一","二","三","四","五","六") -> 二 | C25: 1723486
A26: =A25+1 -> 41388 | B26: =CHOOSE(WEEKDAY(A26,1),"日","一","二","三","四","五","六") -> 三 | C26: 1756104
A27: =A26+1 -> 41389 | B27: =CHOOSE(WEEKDAY(A27,1),"日","一","二","三","四","五","六") -> 四 | C27: 1753582
A28: =A27+1 -> 41390 | B28: =CHOOSE(WEEKDAY(A28,1),"日","一","二","三","四","五","六") -> 五 | C28: 1940270
A29: =A28+1 -> 41391 | B29: =CHOOSE(WEEKDAY(A29,1),"日","一","二","三","四","五","六") -> 六 | C29: 1703794
A30: =A29+1 -> 41392 | B30: =CHOOSE(WEEKDAY(A30,1),"日","一","二","三","四","五","六") -> 日 | C30: 1468731
A31: =A30+1 -> 41393 | B31: =CHOOSE(WEEKDAY(A31,1),"日","一","二","三","四","五","六") -> 一 | C31: 1723651
A32: =A31+1 -> 41394 | B32: =CHOOSE(WEEKDAY(A32,1),"日","一","二","三","四","五","六") -> 二 | C32: 1770350
A34: 當月總計 | C34: =SUM(C3:C33) -> 50269978
A35: 日平均 | C35: =C34/30 -> 1675665.9333333333
C36: 單位：人次