A1: 臺北捷運公司運量統計表
A2: 營運日 | B2: 星期 | C2: 總 運 量
A3: 41306 | B3: =CHOOSE(WEEKDAY(A3,1),"日","一","二","三","四","五","六") -> 五 | C3: 1966706
A4: =A3+1 -> 41307 | B4: =CHOOSE(WEEKDAY(A4,1),"日","一","二","三","四","五","六") -> 六 | C4: 1755354
A5: =A4+1 -> 41308 | B5: =CHOOSE(WEEKDAY(A5,1),"日","一","二","三","四","五","六") -> 日 | C5: 1443182
A6: =A5+1 -> 41309 | B6: =CHOOSE(WEEKDAY(A6,1),"日","一","二","三","四","五","六") -> 一 | C6: 1782831
A7: =A6+1 -> 41310 | B7: =CHOOSE(WEEKDAY(A7,1),"日","一","二","三","四","五","六") -> 二 | C7: 1828811
A8: =A7+1 -> 41311 | B8: =CHOOSE(WEEKDAY(A8,1),"日","一","二","三","四","五","六") -> 三 | C8: 1830412
A9: =A8+1 -> 41312 | B9: =CHOOSE(WEEKDAY(A9,1),"日","一","二","三","四","五","六") -> 四 | C9: 1768420
A10: =A9+1 -> 41313 | B10: =CHOOSE(WEEKDAY(A10,1),"日","一","二","三","四","五","六") -> 五 | C10: 1629348
A11: =A10+1 -> 41314 | B11: =CHOOSE(WEEKDAY(A11,1),"日","一","二","三","四","五","六") -> 六 | C11: 650048
A12: =A11+1 -> 41315 | B12: =CHOOSE(WEEKDAY(A12,1),"日","一","二","三","四","五","六") -> 日 | C12: 1133249
A13: =A12+1 -> 41316 | B13: =CHOOSE(WEEKDAY(A13,1),"日","一","二","三","四","五","六") -> 一 | C13: 1147338
A14: =A13+1 -> 41317 | B14: =CHOOSE(WEEKDAY(A14,1),"日","一","二","三","四","五","六") -> 二 | C14: 1313934
A15: =A14+1 -> 41318 | B15: =CHOOSE(WEEKDAY(A15,1),"日","一","二","三","四","五","六") -> 三 | C15: 1416824
A16: =A15+1 -> 41319 | B16: =CHOOSE(WEEKDAY(A16,1),"日","一","二","三","四","五","六") -> 四 | C16: 1632363
A17: =A16+1 -> 41320 | B17: =CHOOSE(WEEKDAY(A17,1),"日","一","二","三","四","五","六") -> 五 | C17: 1502532
A18: =A17+1 -> 41321 | B18: =CHOOSE(WEEKDAY(A18,1),"日","一","二","三","四","五","六") -> 六 | C18: 1645900
A19: =A18+1 -> 41322 | B19: =CHOOSE(WEEKDAY(A19,1),"日","一","二","三","四","五","六") -> 日 | C19: 1434778
A20: =A19+1 -> 41323 | B20: =CHOOSE(WEEKDAY(A20,1),"日","一","二","三","四","五","六") -> 一 | C20: 1720288
A21: =A20+1 -> 41324 | B21: =CHOOSE(WEEKDAY(A21,1),"日","一","二","三","四","五","六") -> 二 | C21: 1726132
A22: =A21+1 -> 41325 | B22: =CHOOSE(WEEKDAY(A22,1),"日","一","二","三","四","五","六") -> 三 | C22: 1767374
A23: =A22+1 -> 41326 | B23: =CHOOSE(WEEKDAY(A23,1),"日","一","二","三","四","五","六") -> 四 | C23: 1795443
A24: =A23+1 -> 41327 | B24: =CHOOSE(WEEKDAY(A24,1),"日","一","二","三","四","五","六") -> 五 | C24: 1926392
A25: =A24+1 -> 41328 | B25: =CHOOSE(WEEKDAY(A25,1),"日","一","二","三","四","五","六") -> 六 | C25: 2018411
A26: =A25+1 -> 41329 | B26: =CHOOSE(WEEKDAY(A26,1),"日","一","二","三","四","五","六") -> 日 | C26: 1677418
A27: =A26+1 -> 41330 | B27: =CHOOSE(WEEKDAY(A27,1),"日","一","二","三","四","五","六") -> 一 | C27: 1798037
A28: =A27+1 -> 41331 | B28: =CHOOSE(WEEKDAY(A28,1),"日","一","二","三","四","五","六") -> 二 | C28: 1816996
A29: =A28+1 -> 41332 | B29: =CHOOSE(WEEKDAY(A29,1),"日","一","二","三","四","五","六") -> 三 | C29: 1898748
A30: =A29+1 -> 41333 | B30: =CHOOSE(WEEKDAY(A30,1),"日","一","二","三","四","五","六") -> 四 | C30: 1759422
A34: 當月總計 | C34: =SUM(C3:C33) -> 45786691
A35: 日平均 | C35: =C34/28 -> 1635238.9642857143
C36: 單位：人次