A1: 臺北捷運公司運量統計表
A2: 營運日 | B2: 星期 | C2: 總 運 量
A3: 41487 | B3: =CHOOSE(WEEKDAY(A3,1),"日","一","二","三","四","五","六") -> 四 | C3: 1797028
A4: =A3+1 -> 41488 | B4: =CHOOSE(WEEKDAY(A4,1),"日","一","二","三","四","五","六") -> 五 | C4: 1896928
A5: =A4+1 -> 41489 | B5: =CHOOSE(WEEKDAY(A5,1),"日","一","二","三","四","五","六") -> 六 | C5: 1793323
A6: =A5+1 -> 41490 | B6: =CHOOSE(WEEKDAY(A6,1),"日","一","二","三","四","五","六") -> 日 | C6: 1472957
A7: =A6+1 -> 41491 | B7: =CHOOSE(WEEKDAY(A7,1),"日","一","二","三","四","五","六") -> 一 | C7: 1755666
A8: =A7+1 -> 41492 | B8: =CHOOSE(WEEKDAY(A8,1),"日","一","二","三","四","五","六") -> 二 | C8: 1790289
A9: =A8+1 -> 41493 | B9: =CHOOSE(WEEKDAY(A9,1),"日","一","二","三","四","五","六") -> 三 | C9: 1804075
A10: =A9+1 -> 41494 | B10: =CHOOSE(WEEKDAY(A10,1),"日","一","二","三","四","五","六") -> 四 | C10: 1752429
A11: =A10+1 -> 41495 | B11: =CHOOSE(WEEKDAY(A11,1),"日","一","二","三","四","五","六") -> 五 | C11: 1914630
A12: =A11+1 -> 41496 | B12: =CHOOSE(WEEKDAY(A12,1),"日","一","二","三","四","五","六") -> 六 | C12: 1801399
A13: =A12+1 -> 41497 | B13: =CHOOSE(WEEKDAY(A13,1),"日","一","二","三","四","五","六") -> 日 | C13: 1536439
A14: =A13+1 -> 41498 | B14: =CHOOSE(WEEKDAY(A14,1),"日","一","二","三","四","五","六") -> 一 | C14: 1775713
A15: =A14+1 -> 41499 | B15: =CHOOSE(WEEKDAY(A15,1),"日","一","二","三","四","五","六") -> 二 | C15: 1847084
A16: =A15+1 -> 41500 | B16: =CHOOSE(WEEKDAY(A16,1),"日","一","二","三","四","五","六") -> 三 | C16: 1789623
A17: =A16+1 -> 41501 | B17: =CHOOSE(WEEKDAY(A17,1),"日","一","二","三","四","五","六") -> 四 | C17: 1840311
A18: =A17+1 -> 41502 | B18: =CHOOSE(WEEKDAY(A18,1),"日","一","二","三","四","五","六") -> 五 | C18: 1940477
A19: =A18+1 -> 41503 | B19: =CHOOSE(WEEKDAY(A19,1),"日","一","二","三","四","五","六") -> 六 | C19: 1720931
A20: =A19+1 -> 41504 | B20: =CHOOSE(WEEKDAY(A20,1),"日","一","二","三","四","五","六") -> 日 | C20: 1521899
A21: =A20+1 -> 41505 | B21: =CHOOSE(WEEKDAY(A21,1),"日","一","二","三","四","五","六") -> 一 | C21: 1767918
A22: =A21+1 -> 41506 | B22: =CHOOSE(WEEKDAY(A22,1),"日","一","二","三","四","五","六") -> 二 | C22: 1667913
A23: =A22+1 -> 41507 | B23: =CHOOSE(WEEKDAY(A23,1),"日","一","二","三","四","五","六") -> 三 | C23: 511823
A24: =A23+1 -> 41508 | B24: =CHOOSE(WEEKDAY(A24,1),"日","一","二","三","四","五","六") -> 四 | C24: 1712172
A25: =A24+1 -> 41509 | B25: =CHOOSE(WEEKDAY(A25,1),"日","一","二","三","四","五","六") -> 五 | C25: 1890683
A26: =A25+1 -> 41510 | B26: =CHOOSE(WEEKDAY(A26,1),"日","一","二","三","四","五","六") -> 六 | C26: 1697805
A27: =A26+1 -> 41511 | B27: =CHOOSE(WEEKDAY(A27,1),"日","一","二","三","四","五","六") -> 日 | C27: 1482297
A28: =A27+1 -> 41512 | B28: =CHOOSE(WEEKDAY(A28,1),"日","一","二","三","四","五","六") -> 一 | C28: 1784869
A29: =A28+1 -> 41513 | B29: =CHOOSE(WEEKDAY(A29,1),"日","一","二","三","四","五","六") -> 二 | C29: 1829763
A30: =A29+1 -> 41514 | B30: =CHOOSE(WEEKDAY(A30,1),"日","一","二","三","四","五","六") -> 三 | C30: 1814008
A31: =A30+1 -> 41515 | B31: =CHOOSE(WEEKDAY(A31,1),"日","一","二","三","四","五","六") -> 四 | C31: 1645597
A32: =A31+1 -> 41516 | B32: =CHOOSE(WEEKDAY(A32,1),"日","一","二","三","四","五","六") -> 五 | C32: 1886421
A33: =A32+1 -> 41517 | B33: =CHOOSE(WEEKDAY(A33,1),"日","一","二","三","四","五","六") -> 六 | C33: 1541666
A34: 當月總計 | C34: =SUM(C3:C33) -> 52984136
A35: 日平均 | C35: =C34/31 -> 1709165.6774193549
C36: 單位：人次