A1: 臺北捷運公司運量統計表
A2: 營運日 | B2: 星期 | C2: 總 運 量
A3: 41426 | B3: =CHOOSE(WEEKDAY(A3,1),"日","一","二","三","四","五","六") -> 六 | C3: 1668119
A4: =A3+1 -> 41427 | B4: =CHOOSE(WEEKDAY(A4,1),"日","一","二","三","四","五","六") -> 日 | C4: 1389988
A5: =A4+1 -> 41428 | B5: =CHOOSE(WEEKDAY(A5,1),"日","一","二","三","四","五","六") -> 一 | C5: 1678682
A6: =A5+1 -> 41429 | B6: =CHOOSE(WEEKDAY(A6,1),"日","一","二","三","四","五","六") -> 二 | C6: 1698742
A7: =A6+1 -> 41430 | B7: =CHOOSE(WEEKDAY(A7,1),"日","一","二","三","四","五","六") -> 三 | C7: 1760514
A8: =A7+1 -> 41431 | B8: =CHOOSE(WEEKDAY(A8,1),"日","一","二","三","四","五","六") -> 四 | C8: 1778016
A9: =A8+1 -> 41432 | B9: =CHOOSE(WEEKDAY(A9,1),"日","一","二","三","四","五","六") -> 五 | C9: 1970258
A10: =A9+1 -> 41433 | B10: =CHOOSE(WEEKDAY(A10,1),"日","一","二","三","四","五","六") -> 六 | C10: 1704305
A11: =A10+1 -> 41434 | B11: =CHOOSE(WEEKDAY(A11,1),"日","一","二","三","四","五","六") -> 日 | C11: 1398912
A12: =A11+1 -> 41435 | B12: =CHOOSE(WEEKDAY(A12,1),"日","一","二","三","四","五","六") -> 一 | C12: 1708804
A13: =A12+1 -> 41436 | B13: =CHOOSE(WEEKDAY(A13,1),"日","一","二","三","四","五","六") -> 二 | C13: 1839135
A14: =A13+1 -> 41437 | B14: =CHOOSE(WEEKDAY(A14,1),"日","一","二","三","四","五","六") -> 三 | C14: 1141858
A15: =A14+1 -> 41438 | B15: =CHOOSE(WEEKDAY(A15,1),"日","一","二","三","四","五","六") -> 四 | C15: 1770483
A16: =A15+1 -> 41439 | B16: =CHOOSE(WEEKDAY(A16,1),"日","一","二","三","四","五","六") -> 五 | C16: 1899869
A17: =A16+1 -> 41440 | B17: =CHOOSE(WEEKDAY(A17,1),"日","一","二","三","四","五","六") -> 六 | C17: 1678647
A18: =A17+1 -> 41441 | B18: =CHOOSE(WEEKDAY(A18,1),"日","一","二","三","四","五","六") -> 日 | C18: 1385169
A19: =A18+1 -> 41442 | B19: =CHOOSE(WEEKDAY(A19,1),"日","一","二","三","四","五","六") -> 一 | C19: 1687810
A20: =A19+1 -> 41443 | B20: =CHOOSE(WEEKDAY(A20,1),"日","一","二","三","四","五","六") -> 二 | C20: 1727269
A21: =A20+1 -> 41444 | B21: =CHOOSE(WEEKDAY(A21,1),"日","一","二","三","四","五","六") -> 三 | C21: 1754922
A22: =A21+1 -> 41445 | B22: =CHOOSE(WEEKDAY(A22,1),"日","一","二","三","四","五","六") -> 四 | C22: 1763858
A23: =A22+1 -> 41446 | B23: =CHOOSE(WEEKDAY(A23,1),"日","一","二","三","四","五","六") -> 五 | C23: 1900652
A24: =A23+1 -> 41447 | B24: =CHOOSE(WEEKDAY(A24,1),"日","一","二","三","四","五","六") -> 六 | C24: 1651353
A25: =A24+1 -> 41448 | B25: =CHOOSE(WEEKDAY(A25,1),"日","一","二","三","四","五","六") -> 日 | C25: 1337945
A26: =A25+1 -> 41449 | B26: =CHOOSE(WEEKDAY(A26,1),"日","一","二","三","四","五","六") -> 一 | C26: 1699711
A27: =A26+1 -> 41450 | B27: =CHOOSE(WEEKDAY(A27,1),"日","一","二","三","四","五","六") -> 二 | C27: 1747681
A28: =A27+1 -> 41451 | B28: =CHOOSE(WEEKDAY(A28,1),"日","一","二","三","四","五","六") -> 三 | C28: 1766092
A29: =A28+1 -> 41452 | B29: =CHOOSE(WEEKDAY(A29,1),"日","一","二","三","四","五","六") -> 四 | C29: 1789749
A30: =A29+1 -> 41453 | B30: =CHOOSE(WEEKDAY(A30,1),"日","一","二","三","四","五","六") -> 五 | C30: 2019581
A31: =A30+1 -> 41454 | B31: =CHOOSE(WEEKDAY(A31,1),"日","一","二","三","四","五","六") -> 六 | C31: 1697223
A32: =A31+1 -> 41455 | B32: =CHOOSE(WEEKDAY(A32,1),"日","一","二","三","四","五","六") -> 日 | C32: 1451166
A34: 當月總計 | C34: =SUM(C3:C33) -> 50466513
A35: 日平均 | C35: =C34/30 -> 1682217.1
C36: 單位：人次