A1: 臺北捷運公司運量統計表
A2: 營運日 | B2: 星期 | C2: 總 運 量
A3: 41579 | B3: =CHOOSE(WEEKDAY(A3,1),"日","一","二","三","四","五","六") -> 五 | C3: 1955794
A4: =A3+1 -> 41580 | B4: =CHOOSE(WEEKDAY(A4,1),"日","一","二","三","四","五","六") -> 六 | C4: 1716683
A5: =A4+1 -> 41581 | B5: =CHOOSE(WEEKDAY(A5,1),"日","一","二","三","四","五","六") -> 日 | C5: 1413823
A6: =A5+1 -> 41582 | B6: =CHOOSE(WEEKDAY(A6,1),"日","一","二","三","四","五","六") -> 一 | C6: 1753261
A7: =A6+1 -> 41583 | B7: =CHOOSE(WEEKDAY(A7,1),"日","一","二","三","四","五","六") -> 二 | C7: 1774441
A8: =A7+1 -> 41584 | B8: =CHOOSE(WEEKDAY(A8,1),"日","一","二","三","四","五","六") -> 三 | C8: 1796457
A9: =A8+1 -> 41585 | B9: =CHOOSE(WEEKDAY(A9,1),"日","一","二","三","四","五","六") -> 四 | C9: 1826078
A10: =A9+1 -> 41586 | B10: =CHOOSE(WEEKDAY(A10,1),"日","一","二","三","四","五","六") -> 五 | C10: 2027799
A11: =A10+1 -> 41587 | B11: =CHOOSE(WEEKDAY(A11,1),"日","一","二","三","四","五","六") -> 六 | C11: 1866954
A12: =A11+1 -> 41588 | B12: =CHOOSE(WEEKDAY(A12,1),"日","一","二","三","四","五","六") -> 日 | C12: 1561963
A13: =A12+1 -> 41589 | B13: =CHOOSE(WEEKDAY(A13,1),"日","一","二","三","四","五","六") -> 一 | C13: 1802327
A14: =A13+1 -> 41590 | B14: =CHOOSE(WEEKDAY(A14,1),"日","一","二","三","四","五","六") -> 二 | C14: 1811535
A15: =A14+1 -> 41591 | B15: =CHOOSE(WEEKDAY(A15,1),"日","一","二","三","四","五","六") -> 三 | C15: 1847928
A16: =A15+1 -> 41592 | B16: =CHOOSE(WEEKDAY(A16,1),"日","一","二","三","四","五","六") -> 四 | C16: 1842816
A17: =A16+1 -> 41593 | B17: =CHOOSE(WEEKDAY(A17,1),"日","一","二","三","四","五","六") -> 五 | C17: 2018627
A18: =A17+1 -> 41594 | B18: =CHOOSE(WEEKDAY(A18,1),"日","一","二","三","四","五","六") -> 六 | C18: 1790101
A19: =A18+1 -> 41595 | B19: =CHOOSE(WEEKDAY(A19,1),"日","一","二","三","四","五","六") -> 日 | C19: 1570522
A20: =A19+1 -> 41596 | B20: =CHOOSE(WEEKDAY(A20,1),"日","一","二","三","四","五","六") -> 一 | C20: 1803591
A21: =A20+1 -> 41597 | B21: =CHOOSE(WEEKDAY(A21,1),"日","一","二","三","四","五","六") -> 二 | C21: 1805778
A22: =A21+1 -> 41598 | B22: =CHOOSE(WEEKDAY(A22,1),"日","一","二","三","四","五","六") -> 三 | C22: 1828585
A23: =A22+1 -> 41599 | B23: =CHOOSE(WEEKDAY(A23,1),"日","一","二","三","四","五","六") -> 四 | C23: 1829037
A24: =A23+1 -> 41600 | B24: =CHOOSE(WEEKDAY(A24,1),"日","一","二","三","四","五","六") -> 五 | C24: 2035386
A25: =A24+1 -> 41601 | B25: =CHOOSE(WEEKDAY(A25,1),"日","一","二","三","四","五","六") -> 六 | C25: 1854196
A26: =A25+1 -> 41602 | B26: =CHOOSE(WEEKDAY(A26,1),"日","一","二","三","四","五","六") -> 日 | C26: 1824027
A27: =A26+1 -> 41603 | B27: =CHOOSE(WEEKDAY(A27,1),"日","一","二","三","四","五","六") -> 一 | C27: 1917363
A28: =A27+1 -> 41604 | B28: =CHOOSE(WEEKDAY(A28,1),"日","一","二","三","四","五","六") -> 二 | C28: 1942574
A29: =A28+1 -> 41605 | B29: =CHOOSE(WEEKDAY(A29,1),"日","一","二","三","四","五","六") -> 三 | C29: 1954670
A30: =A29+1 -> 41606 | B30: =CHOOSE(WEEKDAY(A30,1),"日","一","二","三","四","五","六") -> 四 | C30: 1950784
A31: =A30+1 -> 41607 | B31: =CHOOSE(WEEKDAY(A31,1),"日","一","二","三","四","五","六") -> 五 | C31: 2166779
A32: =A31+1 -> 41608 | B32: =CHOOSE(WEEKDAY(A32,1),"日","一","二","三","四","五","六") -> 六 | C32: 2157719
A34: 當月總計 | C34: =SUM(C3:C33) -> 55447598
A35: 日平均 | C35: =C34/30 -> 1848253.2666666666
C36: 單位：人次