A1: 臺北捷運公司運量統計表
A2: 營運日 | B2: 星期 | C2: 總 運 量
A3: 41640 | B3: =CHOOSE(WEEKDAY(A3,1),"日","一","二","三","四","五","六") -> 三 | C3: 1618475
A4: =A3+1 -> 41641 | B4: =CHOOSE(WEEKDAY(A4,1),"日","一","二","三","四","五","六") -> 四 | C4: 1917052
A5: =A4+1 -> 41642 | B5: =CHOOSE(WEEKDAY(A5,1),"日","一","二","三","四","五","六") -> 五 | C5: 2052758
A6: =A5+1 -> 41643 | B6: =CHOOSE(WEEKDAY(A6,1),"日","一","二","三","四","五","六") -> 六 | C6: 1725697
A7: =A6+1 -> 41644 | B7: =CHOOSE(WEEKDAY(A7,1),"日","一","二","三","四","五","六") -> 日 | C7: 1487552
A8: =A7+1 -> 41645 | B8: =CHOOSE(WEEKDAY(A8,1),"日","一","二","三","四","五","六") -> 一 | C8: 1819991
A9: =A8+1 -> 41646 | B9: =CHOOSE(WEEKDAY(A9,1),"日","一","二","三","四","五","六") -> 二 | C9: 1853789
A10: =A9+1 -> 41647 | B10: =CHOOSE(WEEKDAY(A10,1),"日","一","二","三","四","五","六") -> 三 | C10: 1869550
A11: =A10+1 -> 41648 | B11: =CHOOSE(WEEKDAY(A11,1),"日","一","二","三","四","五","六") -> 四 | C11: 1891773
A12: =A11+1 -> 41649 | B12: =CHOOSE(WEEKDAY(A12,1),"日","一","二","三","四","五","六") -> 五 | C12: 2082405
A13: =A12+1 -> 41650 | B13: =CHOOSE(WEEKDAY(A13,1),"日","一","二","三","四","五","六") -> 六 | C13: 1844438
A14: =A13+1 -> 41651 | B14: =CHOOSE(WEEKDAY(A14,1),"日","一","二","三","四","五","六") -> 日 | C14: 1489622
A15: =A14+1 -> 41652 | B15: =CHOOSE(WEEKDAY(A15,1),"日","一","二","三","四","五","六") -> 一 | C15: 1826415
A16: =A15+1 -> 41653 | B16: =CHOOSE(WEEKDAY(A16,1),"日","一","二","三","四","五","六") -> 二 | C16: 1857620
A17: =A16+1 -> 41654 | B17: =CHOOSE(WEEKDAY(A17,1),"日","一","二","三","四","五","六") -> 三 | C17: 1884097
A18: =A17+1 -> 41655 | B18: =CHOOSE(WEEKDAY(A18,1),"日","一","二","三","四","五","六") -> 四 | C18: 1906222
A19: =A18+1 -> 41656 | B19: =CHOOSE(WEEKDAY(A19,1),"日","一","二","三","四","五","六") -> 五 | C19: 2143286
A20: =A19+1 -> 41657 | B20: =CHOOSE(WEEKDAY(A20,1),"日","一","二","三","四","五","六") -> 六 | C20: 1904225
A21: =A20+1 -> 41658 | B21: =CHOOSE(WEEKDAY(A21,1),"日","一","二","三","四","五","六") -> 日 | C21: 1675491
A22: =A21+1 -> 41659 | B22: =CHOOSE(WEEKDAY(A22,1),"日","一","二","三","四","五","六") -> 一 | C22: 1994266
A23: =A22+1 -> 41660 | B23: =CHOOSE(WEEKDAY(A23,1),"日","一","二","三","四","五","六") -> 二 | C23: 1938150
A24: =A23+1 -> 41661 | B24: =CHOOSE(WEEKDAY(A24,1),"日","一","二","三","四","五","六") -> 三 | C24: 1964416
A25: =A24+1 -> 41662 | B25: =CHOOSE(WEEKDAY(A25,1),"日","一","二","三","四","五","六") -> 四 | C25: 2023238
A26: =A25+1 -> 41663 | B26: =CHOOSE(WEEKDAY(A26,1),"日","一","二","三","四","五","六") -> 五 | C26: 2093369
A27: =A26+1 -> 41664 | B27: =CHOOSE(WEEKDAY(A27,1),"日","一","二","三","四","五","六") -> 六 | C27: 1823478
A28: =A27+1 -> 41665 | B28: =CHOOSE(WEEKDAY(A28,1),"日","一","二","三","四","五","六") -> 日 | C28: 1531457
A29: =A28+1 -> 41666 | B29: =CHOOSE(WEEKDAY(A29,1),"日","一","二","三","四","五","六") -> 一 | C29: 1981827
A30: =A29+1 -> 41667 | B30: =CHOOSE(WEEKDAY(A30,1),"日","一","二","三","四","五","六") -> 二 | C30: 1942186
A31: =A30+1 -> 41668 | B31: =CHOOSE(WEEKDAY(A31,1),"日","一","二","三","四","五","六") -> 三 | C31: 1686002
A32: =A31+1 -> 41669 | B32: =CHOOSE(WEEKDAY(A32,1),"日","一","二","三","四","五","六") -> 四 | C32: 698547
A33: =A32+1 -> 41670 | B33: =CHOOSE(WEEKDAY(A33,1),"日","一","二","三","四","五","六") -> 五 | C33: 1315201
A34: 當月總計 | C34: =SUM(C3:C33) -> 55842595
A35: 日平均 | C35: =C34/31 -> 1801374.0322580645
C36: 單位：人次