A1: 臺北捷運公司運量統計表
A2: 營運日 | B2: 星期 | C2: 總 運 量
A3: 38565 | B3: =CHOOSE(WEEKDAY(A3,1),"日","一","二","三","四","五","六") -> 一 | C3: 1018951
A4: =A3+1 -> 38566 | B4: =CHOOSE(WEEKDAY(A4,1),"日","一","二","三","四","五","六") -> 二 | C4: 1021570
A5: =A4+1 -> 38567 | B5: =CHOOSE(WEEKDAY(A5,1),"日","一","二","三","四","五","六") -> 三 | C5: 1030817
A6: =A5+1 -> 38568 | B6: =CHOOSE(WEEKDAY(A6,1),"日","一","二","三","四","五","六") -> 四 | C6: 902568
A7: =A6+1 -> 38569 | B7: =CHOOSE(WEEKDAY(A7,1),"日","一","二","三","四","五","六") -> 五 | C7: 311261
A8: =A7+1 -> 38570 | B8: =CHOOSE(WEEKDAY(A8,1),"日","一","二","三","四","五","六") -> 六 | C8: 963309
A9: =A8+1 -> 38571 | B9: =CHOOSE(WEEKDAY(A9,1),"日","一","二","三","四","五","六") -> 日 | C9: 810467
A10: =A9+1 -> 38572 | B10: =CHOOSE(WEEKDAY(A10,1),"日","一","二","三","四","五","六") -> 一 | C10: 1042496
A11: =A10+1 -> 38573 | B11: =CHOOSE(WEEKDAY(A11,1),"日","一","二","三","四","五","六") -> 二 | C11: 1065260
A12: =A11+1 -> 38574 | B12: =CHOOSE(WEEKDAY(A12,1),"日","一","二","三","四","五","六") -> 三 | C12: 1107478
A13: =A12+1 -> 38575 | B13: =CHOOSE(WEEKDAY(A13,1),"日","一","二","三","四","五","六") -> 四 | C13: 1112908
A14: =A13+1 -> 38576 | B14: =CHOOSE(WEEKDAY(A14,1),"日","一","二","三","四","五","六") -> 五 | C14: 1072732
A15: =A14+1 -> 38577 | B15: =CHOOSE(WEEKDAY(A15,1),"日","一","二","三","四","五","六") -> 六 | C15: 986147
A16: =A15+1 -> 38578 | B16: =CHOOSE(WEEKDAY(A16,1),"日","一","二","三","四","五","六") -> 日 | C16: 861717
A17: =A16+1 -> 38579 | B17: =CHOOSE(WEEKDAY(A17,1),"日","一","二","三","四","五","六") -> 一 | C17: 1048928
A18: =A17+1 -> 38580 | B18: =CHOOSE(WEEKDAY(A18,1),"日","一","二","三","四","五","六") -> 二 | C18: 1064843
A19: =A18+1 -> 38581 | B19: =CHOOSE(WEEKDAY(A19,1),"日","一","二","三","四","五","六") -> 三 | C19: 1060572
A20: =A19+1 -> 38582 | B20: =CHOOSE(WEEKDAY(A20,1),"日","一","二","三","四","五","六") -> 四 | C20: 1027618
A21: =A20+1 -> 38583 | B21: =CHOOSE(WEEKDAY(A21,1),"日","一","二","三","四","五","六") -> 五 | C21: 1032170
A22: =A21+1 -> 38584 | B22: =CHOOSE(WEEKDAY(A22,1),"日","一","二","三","四","五","六") -> 六 | C22: 964964
A23: =A22+1 -> 38585 | B23: =CHOOSE(WEEKDAY(A23,1),"日","一","二","三","四","五","六") -> 日 | C23: 860165
A24: =A23+1 -> 38586 | B24: =CHOOSE(WEEKDAY(A24,1),"日","一","二","三","四","五","六") -> 一 | C24: 1031395
A25: =A24+1 -> 38587 | B25: =CHOOSE(WEEKDAY(A25,1),"日","一","二","三","四","五","六") -> 二 | C25: 1056599
A26: =A25+1 -> 38588 | B26: =CHOOSE(WEEKDAY(A26,1),"日","一","二","三","四","五","六") -> 三 | C26: 1040676
A27: =A26+1 -> 38589 | B27: =CHOOSE(WEEKDAY(A27,1),"日","一","二","三","四","五","六") -> 四 | C27: 1024416
A28: =A27+1 -> 38590 | B28: =CHOOSE(WEEKDAY(A28,1),"日","一","二","三","四","五","六") -> 五 | C28: 1125840
A29: =A28+1 -> 38591 | B29: =CHOOSE(WEEKDAY(A29,1),"日","一","二","三","四","五","六") -> 六 | C29: 1027175
A30: =A29+1 -> 38592 | B30: =CHOOSE(WEEKDAY(A30,1),"日","一","二","三","四","五","六") -> 日 | C30: 846139
A31: =A30+1 -> 38593 | B31: =CHOOSE(WEEKDAY(A31,1),"日","一","二","三","四","五","六") -> 一 | C31: 994140
A32: =A31+1 -> 38594 | B32: =CHOOSE(WEEKDAY(A32,1),"日","一","二","三","四","五","六") -> 二 | C32: 1011633
A33: =A32+1 -> 38595 | B33: =CHOOSE(WEEKDAY(A33,1),"日","一","二","三","四","五","六") -> 三 | C33: 818912
A34: 當月總計 | C34: =SUM(C3:C33) -> 30343866
A35: 日平均 | C35: =C34/31 -> 978834.38709677418
C36: 單位：人次