A1: 臺北捷運公司運量統計表
A2: 營運日 | B2: 星期 | C2: 總 運 量
A3: 38777 | B3: =CHOOSE(WEEKDAY(A3,1),"日","一","二","三","四","五","六") -> 三 | C3: 1044101
A4: =A3+1 -> 38778 | B4: =CHOOSE(WEEKDAY(A4,1),"日","一","二","三","四","五","六") -> 四 | C4: 1039587
A5: =A4+1 -> 38779 | B5: =CHOOSE(WEEKDAY(A5,1),"日","一","二","三","四","五","六") -> 五 | C5: 1137350
A6: =A5+1 -> 38780 | B6: =CHOOSE(WEEKDAY(A6,1),"日","一","二","三","四","五","六") -> 六 | C6: 1041228
A7: =A6+1 -> 38781 | B7: =CHOOSE(WEEKDAY(A7,1),"日","一","二","三","四","五","六") -> 日 | C7: 840770
A8: =A7+1 -> 38782 | B8: =CHOOSE(WEEKDAY(A8,1),"日","一","二","三","四","五","六") -> 一 | C8: 1027038
A9: =A8+1 -> 38783 | B9: =CHOOSE(WEEKDAY(A9,1),"日","一","二","三","四","五","六") -> 二 | C9: 1038838
A10: =A9+1 -> 38784 | B10: =CHOOSE(WEEKDAY(A10,1),"日","一","二","三","四","五","六") -> 三 | C10: 1057360
A11: =A10+1 -> 38785 | B11: =CHOOSE(WEEKDAY(A11,1),"日","一","二","三","四","五","六") -> 四 | C11: 1049628
A12: =A11+1 -> 38786 | B12: =CHOOSE(WEEKDAY(A12,1),"日","一","二","三","四","五","六") -> 五 | C12: 1157088
A13: =A12+1 -> 38787 | B13: =CHOOSE(WEEKDAY(A13,1),"日","一","二","三","四","五","六") -> 六 | C13: 1080611
A14: =A13+1 -> 38788 | B14: =CHOOSE(WEEKDAY(A14,1),"日","一","二","三","四","五","六") -> 日 | C14: 805580
A15: =A14+1 -> 38789 | B15: =CHOOSE(WEEKDAY(A15,1),"日","一","二","三","四","五","六") -> 一 | C15: 1029942
A16: =A15+1 -> 38790 | B16: =CHOOSE(WEEKDAY(A16,1),"日","一","二","三","四","五","六") -> 二 | C16: 1042560
A17: =A16+1 -> 38791 | B17: =CHOOSE(WEEKDAY(A17,1),"日","一","二","三","四","五","六") -> 三 | C17: 1052838
A18: =A17+1 -> 38792 | B18: =CHOOSE(WEEKDAY(A18,1),"日","一","二","三","四","五","六") -> 四 | C18: 1047632
A19: =A18+1 -> 38793 | B19: =CHOOSE(WEEKDAY(A19,1),"日","一","二","三","四","五","六") -> 五 | C19: 1147826
A20: =A19+1 -> 38794 | B20: =CHOOSE(WEEKDAY(A20,1),"日","一","二","三","四","五","六") -> 六 | C20: 1067487
A21: =A20+1 -> 38795 | B21: =CHOOSE(WEEKDAY(A21,1),"日","一","二","三","四","五","六") -> 日 | C21: 803766
A22: =A21+1 -> 38796 | B22: =CHOOSE(WEEKDAY(A22,1),"日","一","二","三","四","五","六") -> 一 | C22: 1003093
A23: =A22+1 -> 38797 | B23: =CHOOSE(WEEKDAY(A23,1),"日","一","二","三","四","五","六") -> 二 | C23: 1031728
A24: =A23+1 -> 38798 | B24: =CHOOSE(WEEKDAY(A24,1),"日","一","二","三","四","五","六") -> 三 | C24: 1049775
A25: =A24+1 -> 38799 | B25: =CHOOSE(WEEKDAY(A25,1),"日","一","二","三","四","五","六") -> 四 | C25: 1039295
A26: =A25+1 -> 38800 | B26: =CHOOSE(WEEKDAY(A26,1),"日","一","二","三","四","五","六") -> 五 | C26: 1175877
A27: =A26+1 -> 38801 | B27: =CHOOSE(WEEKDAY(A27,1),"日","一","二","三","四","五","六") -> 六 | C27: 994685
A28: =A27+1 -> 38802 | B28: =CHOOSE(WEEKDAY(A28,1),"日","一","二","三","四","五","六") -> 日 | C28: 772855
A29: =A28+1 -> 38803 | B29: =CHOOSE(WEEKDAY(A29,1),"日","一","二","三","四","五","六") -> 一 | C29: 1037606
A30: =A29+1 -> 38804 | B30: =CHOOSE(WEEKDAY(A30,1),"日","一","二","三","四","五","六") -> 二 | C30: 1060042
A31: =A30+1 -> 38805 | B31: =CHOOSE(WEEKDAY(A31,1),"日","一","二","三","四","五","六") -> 三 | C31: 1066976
A32: =A31+1 -> 38806 | B32: =CHOOSE(WEEKDAY(A32,1),"日","一","二","三","四","五","六") -> 四 | C32: 1045397
A33: =A32+1 -> 38807 | B33: =CHOOSE(WEEKDAY(A33,1),"日","一","二","三","四","五","六") -> 五 | C33: 1147445
A34: 當月總計 | C34: =SUM(C3:C33) -> 31936004
A35: 日平均 | C35: =C34/31 -> 1030193.6774193548
C36: 單位：人次