A1: 臺北捷運公司運量統計表
A2: 營運日 | B2: 星期 | C2: 總 運 量
A3: 38899 | B3: =CHOOSE(WEEKDAY(A3,1),"日","一","二","三","四","五","六") -> 六 | C3: 999457
A4: =A3+1 -> 38900 | B4: =CHOOSE(WEEKDAY(A4,1),"日","一","二","三","四","五","六") -> 日 | C4: 848274
A5: =A4+1 -> 38901 | B5: =CHOOSE(WEEKDAY(A5,1),"日","一","二","三","四","五","六") -> 一 | C5: 1096326
A6: =A5+1 -> 38902 | B6: =CHOOSE(WEEKDAY(A6,1),"日","一","二","三","四","五","六") -> 二 | C6: 1103528
A7: =A6+1 -> 38903 | B7: =CHOOSE(WEEKDAY(A7,1),"日","一","二","三","四","五","六") -> 三 | C7: 1123105
A8: =A7+1 -> 38904 | B8: =CHOOSE(WEEKDAY(A8,1),"日","一","二","三","四","五","六") -> 四 | C8: 1127221
A9: =A8+1 -> 38905 | B9: =CHOOSE(WEEKDAY(A9,1),"日","一","二","三","四","五","六") -> 五 | C9: 1188098
A10: =A9+1 -> 38906 | B10: =CHOOSE(WEEKDAY(A10,1),"日","一","二","三","四","五","六") -> 六 | C10: 1042746
A11: =A10+1 -> 38907 | B11: =CHOOSE(WEEKDAY(A11,1),"日","一","二","三","四","五","六") -> 日 | C11: 865342
A12: =A11+1 -> 38908 | B12: =CHOOSE(WEEKDAY(A12,1),"日","一","二","三","四","五","六") -> 一 | C12: 1068244
A13: =A12+1 -> 38909 | B13: =CHOOSE(WEEKDAY(A13,1),"日","一","二","三","四","五","六") -> 二 | C13: 1115179
A14: =A13+1 -> 38910 | B14: =CHOOSE(WEEKDAY(A14,1),"日","一","二","三","四","五","六") -> 三 | C14: 1117485
A15: =A14+1 -> 38911 | B15: =CHOOSE(WEEKDAY(A15,1),"日","一","二","三","四","五","六") -> 四 | C15: 882895
A16: =A15+1 -> 38912 | B16: =CHOOSE(WEEKDAY(A16,1),"日","一","二","三","四","五","六") -> 五 | C16: 1073656
A17: =A16+1 -> 38913 | B17: =CHOOSE(WEEKDAY(A17,1),"日","一","二","三","四","五","六") -> 六 | C17: 962951
A18: =A17+1 -> 38914 | B18: =CHOOSE(WEEKDAY(A18,1),"日","一","二","三","四","五","六") -> 日 | C18: 898318
A19: =A18+1 -> 38915 | B19: =CHOOSE(WEEKDAY(A19,1),"日","一","二","三","四","五","六") -> 一 | C19: 1126412
A20: =A19+1 -> 38916 | B20: =CHOOSE(WEEKDAY(A20,1),"日","一","二","三","四","五","六") -> 二 | C20: 1141677
A21: =A20+1 -> 38917 | B21: =CHOOSE(WEEKDAY(A21,1),"日","一","二","三","四","五","六") -> 三 | C21: 1149377
A22: =A21+1 -> 38918 | B22: =CHOOSE(WEEKDAY(A22,1),"日","一","二","三","四","五","六") -> 四 | C22: 1141822
A23: =A22+1 -> 38919 | B23: =CHOOSE(WEEKDAY(A23,1),"日","一","二","三","四","五","六") -> 五 | C23: 1218764
A24: =A23+1 -> 38920 | B24: =CHOOSE(WEEKDAY(A24,1),"日","一","二","三","四","五","六") -> 六 | C24: 1093312
A25: =A24+1 -> 38921 | B25: =CHOOSE(WEEKDAY(A25,1),"日","一","二","三","四","五","六") -> 日 | C25: 915346
A26: =A25+1 -> 38922 | B26: =CHOOSE(WEEKDAY(A26,1),"日","一","二","三","四","五","六") -> 一 | C26: 1052833
A27: =A26+1 -> 38923 | B27: =CHOOSE(WEEKDAY(A27,1),"日","一","二","三","四","五","六") -> 二 | C27: 997342
A28: =A27+1 -> 38924 | B28: =CHOOSE(WEEKDAY(A28,1),"日","一","二","三","四","五","六") -> 三 | C28: 1116519
A29: =A28+1 -> 38925 | B29: =CHOOSE(WEEKDAY(A29,1),"日","一","二","三","四","五","六") -> 四 | C29: 1138311
A30: =A29+1 -> 38926 | B30: =CHOOSE(WEEKDAY(A30,1),"日","一","二","三","四","五","六") -> 五 | C30: 1199260
A31: =A30+1 -> 38927 | B31: =CHOOSE(WEEKDAY(A31,1),"日","一","二","三","四","五","六") -> 六 | C31: 1092922
A32: =A31+1 -> 38928 | B32: =CHOOSE(WEEKDAY(A32,1),"日","一","二","三","四","五","六") -> 日 | C32: 900468
A33: =A32+1 -> 38929 | B33: =CHOOSE(WEEKDAY(A33,1),"日","一","二","三","四","五","六") -> 一 | C33: 1135813
A34: 當月總計 | C34: =SUM(C3:C33) -> 32933003
A35: 日平均 | C35: =C34/31 -> 1062354.935483871
C36: 單位：人次