A1: 臺北捷運公司運量統計表
A2: 營運日 | B2: 星期 | C2: 總 運 量
A3: 38991 | B3: =CHOOSE(WEEKDAY(A3,1),"日","一","二","三","四","五","六") -> 日 | C3: 870712
A4: =A3+1 -> 38992 | B4: =CHOOSE(WEEKDAY(A4,1),"日","一","二","三","四","五","六") -> 一 | C4: 1106234
A5: =A4+1 -> 38993 | B5: =CHOOSE(WEEKDAY(A5,1),"日","一","二","三","四","五","六") -> 二 | C5: 1123445
A6: =A5+1 -> 38994 | B6: =CHOOSE(WEEKDAY(A6,1),"日","一","二","三","四","五","六") -> 三 | C6: 1153072
A7: =A6+1 -> 38995 | B7: =CHOOSE(WEEKDAY(A7,1),"日","一","二","三","四","五","六") -> 四 | C7: 1252462
A8: =A7+1 -> 38996 | B8: =CHOOSE(WEEKDAY(A8,1),"日","一","二","三","四","五","六") -> 五 | C8: 751414
A9: =A8+1 -> 38997 | B9: =CHOOSE(WEEKDAY(A9,1),"日","一","二","三","四","五","六") -> 六 | C9: 915525
A10: =A9+1 -> 38998 | B10: =CHOOSE(WEEKDAY(A10,1),"日","一","二","三","四","五","六") -> 日 | C10: 887282
A11: =A10+1 -> 38999 | B11: =CHOOSE(WEEKDAY(A11,1),"日","一","二","三","四","五","六") -> 一 | C11: 962132
A12: =A11+1 -> 39000 | B12: =CHOOSE(WEEKDAY(A12,1),"日","一","二","三","四","五","六") -> 二 | C12: 1015088
A13: =A12+1 -> 39001 | B13: =CHOOSE(WEEKDAY(A13,1),"日","一","二","三","四","五","六") -> 三 | C13: 1115065
A14: =A13+1 -> 39002 | B14: =CHOOSE(WEEKDAY(A14,1),"日","一","二","三","四","五","六") -> 四 | C14: 1123194
A15: =A14+1 -> 39003 | B15: =CHOOSE(WEEKDAY(A15,1),"日","一","二","三","四","五","六") -> 五 | C15: 1183186
A16: =A15+1 -> 39004 | B16: =CHOOSE(WEEKDAY(A16,1),"日","一","二","三","四","五","六") -> 六 | C16: 1190544
A17: =A16+1 -> 39005 | B17: =CHOOSE(WEEKDAY(A17,1),"日","一","二","三","四","五","六") -> 日 | C17: 927742
A18: =A17+1 -> 39006 | B18: =CHOOSE(WEEKDAY(A18,1),"日","一","二","三","四","五","六") -> 一 | C18: 1093098
A19: =A18+1 -> 39007 | B19: =CHOOSE(WEEKDAY(A19,1),"日","一","二","三","四","五","六") -> 二 | C19: 1114472
A20: =A19+1 -> 39008 | B20: =CHOOSE(WEEKDAY(A20,1),"日","一","二","三","四","五","六") -> 三 | C20: 1130857
A21: =A20+1 -> 39009 | B21: =CHOOSE(WEEKDAY(A21,1),"日","一","二","三","四","五","六") -> 四 | C21: 1122422
A22: =A21+1 -> 39010 | B22: =CHOOSE(WEEKDAY(A22,1),"日","一","二","三","四","五","六") -> 五 | C22: 1222490
A23: =A22+1 -> 39011 | B23: =CHOOSE(WEEKDAY(A23,1),"日","一","二","三","四","五","六") -> 六 | C23: 1153767
A24: =A23+1 -> 39012 | B24: =CHOOSE(WEEKDAY(A24,1),"日","一","二","三","四","五","六") -> 日 | C24: 932022
A25: =A24+1 -> 39013 | B25: =CHOOSE(WEEKDAY(A25,1),"日","一","二","三","四","五","六") -> 一 | C25: 1088422
A26: =A25+1 -> 39014 | B26: =CHOOSE(WEEKDAY(A26,1),"日","一","二","三","四","五","六") -> 二 | C26: 1112696
A27: =A26+1 -> 39015 | B27: =CHOOSE(WEEKDAY(A27,1),"日","一","二","三","四","五","六") -> 三 | C27: 1127933
A28: =A27+1 -> 39016 | B28: =CHOOSE(WEEKDAY(A28,1),"日","一","二","三","四","五","六") -> 四 | C28: 1125388
A29: =A28+1 -> 39017 | B29: =CHOOSE(WEEKDAY(A29,1),"日","一","二","三","四","五","六") -> 五 | C29: 1232933
A30: =A29+1 -> 39018 | B30: =CHOOSE(WEEKDAY(A30,1),"日","一","二","三","四","五","六") -> 六 | C30: 1126159
A31: =A30+1 -> 39019 | B31: =CHOOSE(WEEKDAY(A31,1),"日","一","二","三","四","五","六") -> 日 | C31: 888837
A32: =A31+1 -> 39020 | B32: =CHOOSE(WEEKDAY(A32,1),"日","一","二","三","四","五","六") -> 一 | C32: 1079326
A33: =A32+1 -> 39021 | B33: =CHOOSE(WEEKDAY(A33,1),"日","一","二","三","四","五","六") -> 二 | C33: 1104854
A34: 當月總計 | C34: =SUM(C3:C33) -> 33232773
A35: 日平均 | C35: =C34/31 -> 1072024.935483871
C36: 單位：人次