A1: 臺北捷運公司運量統計表
A2: 營運日 | B2: 星期 | C2: 總 運 量
A3: 39083 | B3: =CHOOSE(WEEKDAY(A3,1),"日","一","二","三","四","五","六") -> 一 | C3: 990625
A4: =A3+1 -> 39084 | B4: =CHOOSE(WEEKDAY(A4,1),"日","一","二","三","四","五","六") -> 二 | C4: 1111155
A5: =A4+1 -> 39085 | B5: =CHOOSE(WEEKDAY(A5,1),"日","一","二","三","四","五","六") -> 三 | C5: 1140492
A6: =A5+1 -> 39086 | B6: =CHOOSE(WEEKDAY(A6,1),"日","一","二","三","四","五","六") -> 四 | C6: 1141141
A7: =A6+1 -> 39087 | B7: =CHOOSE(WEEKDAY(A7,1),"日","一","二","三","四","五","六") -> 五 | C7: 1250269
A8: =A7+1 -> 39088 | B8: =CHOOSE(WEEKDAY(A8,1),"日","一","二","三","四","五","六") -> 六 | C8: 1063790
A9: =A8+1 -> 39089 | B9: =CHOOSE(WEEKDAY(A9,1),"日","一","二","三","四","五","六") -> 日 | C9: 826412
A10: =A9+1 -> 39090 | B10: =CHOOSE(WEEKDAY(A10,1),"日","一","二","三","四","五","六") -> 一 | C10: 1123810
A11: =A10+1 -> 39091 | B11: =CHOOSE(WEEKDAY(A11,1),"日","一","二","三","四","五","六") -> 二 | C11: 1131562
A12: =A11+1 -> 39092 | B12: =CHOOSE(WEEKDAY(A12,1),"日","一","二","三","四","五","六") -> 三 | C12: 1144947
A13: =A12+1 -> 39093 | B13: =CHOOSE(WEEKDAY(A13,1),"日","一","二","三","四","五","六") -> 四 | C13: 1128400
A14: =A13+1 -> 39094 | B14: =CHOOSE(WEEKDAY(A14,1),"日","一","二","三","四","五","六") -> 五 | C14: 1215270
A15: =A14+1 -> 39095 | B15: =CHOOSE(WEEKDAY(A15,1),"日","一","二","三","四","五","六") -> 六 | C15: 1022792
A16: =A15+1 -> 39096 | B16: =CHOOSE(WEEKDAY(A16,1),"日","一","二","三","四","五","六") -> 日 | C16: 844598
A17: =A16+1 -> 39097 | B17: =CHOOSE(WEEKDAY(A17,1),"日","一","二","三","四","五","六") -> 一 | C17: 1115799
A18: =A17+1 -> 39098 | B18: =CHOOSE(WEEKDAY(A18,1),"日","一","二","三","四","五","六") -> 二 | C18: 1089320
A19: =A18+1 -> 39099 | B19: =CHOOSE(WEEKDAY(A19,1),"日","一","二","三","四","五","六") -> 三 | C19: 1150617
A20: =A19+1 -> 39100 | B20: =CHOOSE(WEEKDAY(A20,1),"日","一","二","三","四","五","六") -> 四 | C20: 1133017
A21: =A20+1 -> 39101 | B21: =CHOOSE(WEEKDAY(A21,1),"日","一","二","三","四","五","六") -> 五 | C21: 1299440
A22: =A21+1 -> 39102 | B22: =CHOOSE(WEEKDAY(A22,1),"日","一","二","三","四","五","六") -> 六 | C22: 1124246
A23: =A22+1 -> 39103 | B23: =CHOOSE(WEEKDAY(A23,1),"日","一","二","三","四","五","六") -> 日 | C23: 876488
A24: =A23+1 -> 39104 | B24: =CHOOSE(WEEKDAY(A24,1),"日","一","二","三","四","五","六") -> 一 | C24: 1125438
A25: =A24+1 -> 39105 | B25: =CHOOSE(WEEKDAY(A25,1),"日","一","二","三","四","五","六") -> 二 | C25: 1124998
A26: =A25+1 -> 39106 | B26: =CHOOSE(WEEKDAY(A26,1),"日","一","二","三","四","五","六") -> 三 | C26: 1150221
A27: =A26+1 -> 39107 | B27: =CHOOSE(WEEKDAY(A27,1),"日","一","二","三","四","五","六") -> 四 | C27: 1152965
A28: =A27+1 -> 39108 | B28: =CHOOSE(WEEKDAY(A28,1),"日","一","二","三","四","五","六") -> 五 | C28: 1302171
A29: =A28+1 -> 39109 | B29: =CHOOSE(WEEKDAY(A29,1),"日","一","二","三","四","五","六") -> 六 | C29: 1075729
A30: =A29+1 -> 39110 | B30: =CHOOSE(WEEKDAY(A30,1),"日","一","二","三","四","五","六") -> 日 | C30: 931088
A31: =A30+1 -> 39111 | B31: =CHOOSE(WEEKDAY(A31,1),"日","一","二","三","四","五","六") -> 一 | C31: 1139792
A32: =A31+1 -> 39112 | B32: =CHOOSE(WEEKDAY(A32,1),"日","一","二","三","四","五","六") -> 二 | C32: 1179922
A33: =A32+1 -> 39113 | B33: =CHOOSE(WEEKDAY(A33,1),"日","一","二","三","四","五","六") -> 三 | C33: 1187156
A34: 當月總計 | C34: =SUM(C3:C33) -> 34293670
A35: 日平均 | C35: =C34/31 -> 1106247.4193548388
C36: 單位：人次