A1: 臺北捷運公司運量統計表
A2: 營運日 | B2: 星期 | C2: 總 運 量
A3: 39203 | B3: =CHOOSE(WEEKDAY(A3,1),"日","一","二","三","四","五","六") -> 二 | C3: 1042259
A4: =A3+1 -> 39204 | B4: =CHOOSE(WEEKDAY(A4,1),"日","一","二","三","四","五","六") -> 三 | C4: 1143318
A5: =A4+1 -> 39205 | B5: =CHOOSE(WEEKDAY(A5,1),"日","一","二","三","四","五","六") -> 四 | C5: 1156308
A6: =A5+1 -> 39206 | B6: =CHOOSE(WEEKDAY(A6,1),"日","一","二","三","四","五","六") -> 五 | C6: 1272880
A7: =A6+1 -> 39207 | B7: =CHOOSE(WEEKDAY(A7,1),"日","一","二","三","四","五","六") -> 六 | C7: 1081174
A8: =A7+1 -> 39208 | B8: =CHOOSE(WEEKDAY(A8,1),"日","一","二","三","四","五","六") -> 日 | C8: 975898
A9: =A8+1 -> 39209 | B9: =CHOOSE(WEEKDAY(A9,1),"日","一","二","三","四","五","六") -> 一 | C9: 1147009
A10: =A9+1 -> 39210 | B10: =CHOOSE(WEEKDAY(A10,1),"日","一","二","三","四","五","六") -> 二 | C10: 1145176
A11: =A10+1 -> 39211 | B11: =CHOOSE(WEEKDAY(A11,1),"日","一","二","三","四","五","六") -> 三 | C11: 1164454
A12: =A11+1 -> 39212 | B12: =CHOOSE(WEEKDAY(A12,1),"日","一","二","三","四","五","六") -> 四 | C12: 1166079
A13: =A12+1 -> 39213 | B13: =CHOOSE(WEEKDAY(A13,1),"日","一","二","三","四","五","六") -> 五 | C13: 1288306
A14: =A13+1 -> 39214 | B14: =CHOOSE(WEEKDAY(A14,1),"日","一","二","三","四","五","六") -> 六 | C14: 1138491
A15: =A14+1 -> 39215 | B15: =CHOOSE(WEEKDAY(A15,1),"日","一","二","三","四","五","六") -> 日 | C15: 869947
A16: =A15+1 -> 39216 | B16: =CHOOSE(WEEKDAY(A16,1),"日","一","二","三","四","五","六") -> 一 | C16: 1116763
A17: =A16+1 -> 39217 | B17: =CHOOSE(WEEKDAY(A17,1),"日","一","二","三","四","五","六") -> 二 | C17: 1129293
A18: =A17+1 -> 39218 | B18: =CHOOSE(WEEKDAY(A18,1),"日","一","二","三","四","五","六") -> 三 | C18: 1146783
A19: =A18+1 -> 39219 | B19: =CHOOSE(WEEKDAY(A19,1),"日","一","二","三","四","五","六") -> 四 | C19: 1145160
A20: =A19+1 -> 39220 | B20: =CHOOSE(WEEKDAY(A20,1),"日","一","二","三","四","五","六") -> 五 | C20: 1263990
A21: =A20+1 -> 39221 | B21: =CHOOSE(WEEKDAY(A21,1),"日","一","二","三","四","五","六") -> 六 | C21: 1193956
A22: =A21+1 -> 39222 | B22: =CHOOSE(WEEKDAY(A22,1),"日","一","二","三","四","五","六") -> 日 | C22: 919951
A23: =A22+1 -> 39223 | B23: =CHOOSE(WEEKDAY(A23,1),"日","一","二","三","四","五","六") -> 一 | C23: 1114831
A24: =A23+1 -> 39224 | B24: =CHOOSE(WEEKDAY(A24,1),"日","一","二","三","四","五","六") -> 二 | C24: 1130777
A25: =A24+1 -> 39225 | B25: =CHOOSE(WEEKDAY(A25,1),"日","一","二","三","四","五","六") -> 三 | C25: 1135338
A26: =A25+1 -> 39226 | B26: =CHOOSE(WEEKDAY(A26,1),"日","一","二","三","四","五","六") -> 四 | C26: 1156746
A27: =A26+1 -> 39227 | B27: =CHOOSE(WEEKDAY(A27,1),"日","一","二","三","四","五","六") -> 五 | C27: 1277892
A28: =A27+1 -> 39228 | B28: =CHOOSE(WEEKDAY(A28,1),"日","一","二","三","四","五","六") -> 六 | C28: 1130021
A29: =A28+1 -> 39229 | B29: =CHOOSE(WEEKDAY(A29,1),"日","一","二","三","四","五","六") -> 日 | C29: 983316
A30: =A29+1 -> 39230 | B30: =CHOOSE(WEEKDAY(A30,1),"日","一","二","三","四","五","六") -> 一 | C30: 1105280
A31: =A30+1 -> 39231 | B31: =CHOOSE(WEEKDAY(A31,1),"日","一","二","三","四","五","六") -> 二 | C31: 1122818
A32: =A31+1 -> 39232 | B32: =CHOOSE(WEEKDAY(A32,1),"日","一","二","三","四","五","六") -> 三 | C32: 1133884
A33: =A32+1 -> 39233 | B33: =CHOOSE(WEEKDAY(A33,1),"日","一","二","三","四","五","六") -> 四 | C33: 1126862
A34: 當月總計 | C34: =SUM(C3:C33) -> 34924960
A35: 日平均 | C35: =C34/31 -> 1126611.6129032257
C36: 單位：人次