A1: 臺北捷運公司運量統計表
A2: 營運日 | B2: 星期 | C2: 總 運 量
A3: 39264 | B3: =CHOOSE(WEEKDAY(A3,1),"日","一","二","三","四","五","六") -> 日 | C3: 938894
A4: =A3+1 -> 39265 | B4: =CHOOSE(WEEKDAY(A4,1),"日","一","二","三","四","五","六") -> 一 | C4: 1168898
A5: =A4+1 -> 39266 | B5: =CHOOSE(WEEKDAY(A5,1),"日","一","二","三","四","五","六") -> 二 | C5: 1191846
A6: =A5+1 -> 39267 | B6: =CHOOSE(WEEKDAY(A6,1),"日","一","二","三","四","五","六") -> 三 | C6: 1202368
A7: =A6+1 -> 39268 | B7: =CHOOSE(WEEKDAY(A7,1),"日","一","二","三","四","五","六") -> 四 | C7: 1188119
A8: =A7+1 -> 39269 | B8: =CHOOSE(WEEKDAY(A8,1),"日","一","二","三","四","五","六") -> 五 | C8: 1293317
A9: =A8+1 -> 39270 | B9: =CHOOSE(WEEKDAY(A9,1),"日","一","二","三","四","五","六") -> 六 | C9: 1159708
A10: =A9+1 -> 39271 | B10: =CHOOSE(WEEKDAY(A10,1),"日","一","二","三","四","五","六") -> 日 | C10: 986630
A11: =A10+1 -> 39272 | B11: =CHOOSE(WEEKDAY(A11,1),"日","一","二","三","四","五","六") -> 一 | C11: 1158730
A12: =A11+1 -> 39273 | B12: =CHOOSE(WEEKDAY(A12,1),"日","一","二","三","四","五","六") -> 二 | C12: 1205703
A13: =A12+1 -> 39274 | B13: =CHOOSE(WEEKDAY(A13,1),"日","一","二","三","四","五","六") -> 三 | C13: 1188153
A14: =A13+1 -> 39275 | B14: =CHOOSE(WEEKDAY(A14,1),"日","一","二","三","四","五","六") -> 四 | C14: 1211353
A15: =A14+1 -> 39276 | B15: =CHOOSE(WEEKDAY(A15,1),"日","一","二","三","四","五","六") -> 五 | C15: 1275868
A16: =A15+1 -> 39277 | B16: =CHOOSE(WEEKDAY(A16,1),"日","一","二","三","四","五","六") -> 六 | C16: 1113265
A17: =A16+1 -> 39278 | B17: =CHOOSE(WEEKDAY(A17,1),"日","一","二","三","四","五","六") -> 日 | C17: 967940
A18: =A17+1 -> 39279 | B18: =CHOOSE(WEEKDAY(A18,1),"日","一","二","三","四","五","六") -> 一 | C18: 1193350
A19: =A18+1 -> 39280 | B19: =CHOOSE(WEEKDAY(A19,1),"日","一","二","三","四","五","六") -> 二 | C19: 1210588
A20: =A19+1 -> 39281 | B20: =CHOOSE(WEEKDAY(A20,1),"日","一","二","三","四","五","六") -> 三 | C20: 1216079
A21: =A20+1 -> 39282 | B21: =CHOOSE(WEEKDAY(A21,1),"日","一","二","三","四","五","六") -> 四 | C21: 1205005
A22: =A21+1 -> 39283 | B22: =CHOOSE(WEEKDAY(A22,1),"日","一","二","三","四","五","六") -> 五 | C22: 1281812
A23: =A22+1 -> 39284 | B23: =CHOOSE(WEEKDAY(A23,1),"日","一","二","三","四","五","六") -> 六 | C23: 1155683
A24: =A23+1 -> 39285 | B24: =CHOOSE(WEEKDAY(A24,1),"日","一","二","三","四","五","六") -> 日 | C24: 957742
A25: =A24+1 -> 39286 | B25: =CHOOSE(WEEKDAY(A25,1),"日","一","二","三","四","五","六") -> 一 | C25: 1155116
A26: =A25+1 -> 39287 | B26: =CHOOSE(WEEKDAY(A26,1),"日","一","二","三","四","五","六") -> 二 | C26: 1165846
A27: =A26+1 -> 39288 | B27: =CHOOSE(WEEKDAY(A27,1),"日","一","二","三","四","五","六") -> 三 | C27: 1194523
A28: =A27+1 -> 39289 | B28: =CHOOSE(WEEKDAY(A28,1),"日","一","二","三","四","五","六") -> 四 | C28: 1194409
A29: =A28+1 -> 39290 | B29: =CHOOSE(WEEKDAY(A29,1),"日","一","二","三","四","五","六") -> 五 | C29: 1270373
A30: =A29+1 -> 39291 | B30: =CHOOSE(WEEKDAY(A30,1),"日","一","二","三","四","五","六") -> 六 | C30: 1124431
A31: =A30+1 -> 39292 | B31: =CHOOSE(WEEKDAY(A31,1),"日","一","二","三","四","五","六") -> 日 | C31: 936994
A32: =A31+1 -> 39293 | B32: =CHOOSE(WEEKDAY(A32,1),"日","一","二","三","四","五","六") -> 一 | C32: 1131248
A33: =A32+1 -> 39294 | B33: =CHOOSE(WEEKDAY(A33,1),"日","一","二","三","四","五","六") -> 二 | C33: 1172771
A34: 當月總計 | C34: =SUM(C3:C33) -> 35816762
A35: 日平均 | C35: =C34/31 -> 1155379.4193548388
C36: 單位：人次