A1: 臺北捷運公司運量統計表
A2: 營運日 | B2: 星期 | C2: 總 運 量
A3: 39356 | B3: =CHOOSE(WEEKDAY(A3,1),"日","一","二","三","四","五","六") -> 一 | C3: 1179255
A4: =A3+1 -> 39357 | B4: =CHOOSE(WEEKDAY(A4,1),"日","一","二","三","四","五","六") -> 二 | C4: 1197558
A5: =A4+1 -> 39358 | B5: =CHOOSE(WEEKDAY(A5,1),"日","一","二","三","四","五","六") -> 三 | C5: 1206296
A6: =A5+1 -> 39359 | B6: =CHOOSE(WEEKDAY(A6,1),"日","一","二","三","四","五","六") -> 四 | C6: 1216990
A7: =A6+1 -> 39360 | B7: =CHOOSE(WEEKDAY(A7,1),"日","一","二","三","四","五","六") -> 五 | C7: 1297442
A8: =A7+1 -> 39361 | B8: =CHOOSE(WEEKDAY(A8,1),"日","一","二","三","四","五","六") -> 六 | C8: 150664
A9: =A8+1 -> 39362 | B9: =CHOOSE(WEEKDAY(A9,1),"日","一","二","三","四","五","六") -> 日 | C9: 691217
A10: =A9+1 -> 39363 | B10: =CHOOSE(WEEKDAY(A10,1),"日","一","二","三","四","五","六") -> 一 | C10: 1214380
A11: =A10+1 -> 39364 | B11: =CHOOSE(WEEKDAY(A11,1),"日","一","二","三","四","五","六") -> 二 | C11: 1298688
A12: =A11+1 -> 39365 | B12: =CHOOSE(WEEKDAY(A12,1),"日","一","二","三","四","五","六") -> 三 | C12: 1088268
A13: =A12+1 -> 39366 | B13: =CHOOSE(WEEKDAY(A13,1),"日","一","二","三","四","五","六") -> 四 | C13: 1207969
A14: =A13+1 -> 39367 | B14: =CHOOSE(WEEKDAY(A14,1),"日","一","二","三","四","五","六") -> 五 | C14: 1342344
A15: =A14+1 -> 39368 | B15: =CHOOSE(WEEKDAY(A15,1),"日","一","二","三","四","五","六") -> 六 | C15: 1196458
A16: =A15+1 -> 39369 | B16: =CHOOSE(WEEKDAY(A16,1),"日","一","二","三","四","五","六") -> 日 | C16: 1007234
A17: =A16+1 -> 39370 | B17: =CHOOSE(WEEKDAY(A17,1),"日","一","二","三","四","五","六") -> 一 | C17: 1187091
A18: =A17+1 -> 39371 | B18: =CHOOSE(WEEKDAY(A18,1),"日","一","二","三","四","五","六") -> 二 | C18: 1201190
A19: =A18+1 -> 39372 | B19: =CHOOSE(WEEKDAY(A19,1),"日","一","二","三","四","五","六") -> 三 | C19: 1227177
A20: =A19+1 -> 39373 | B20: =CHOOSE(WEEKDAY(A20,1),"日","一","二","三","四","五","六") -> 四 | C20: 1207624
A21: =A20+1 -> 39374 | B21: =CHOOSE(WEEKDAY(A21,1),"日","一","二","三","四","五","六") -> 五 | C21: 1328415
A22: =A21+1 -> 39375 | B22: =CHOOSE(WEEKDAY(A22,1),"日","一","二","三","四","五","六") -> 六 | C22: 1259365
A23: =A22+1 -> 39376 | B23: =CHOOSE(WEEKDAY(A23,1),"日","一","二","三","四","五","六") -> 日 | C23: 1045434
A24: =A23+1 -> 39377 | B24: =CHOOSE(WEEKDAY(A24,1),"日","一","二","三","四","五","六") -> 一 | C24: 1174256
A25: =A24+1 -> 39378 | B25: =CHOOSE(WEEKDAY(A25,1),"日","一","二","三","四","五","六") -> 二 | C25: 1184532
A26: =A25+1 -> 39379 | B26: =CHOOSE(WEEKDAY(A26,1),"日","一","二","三","四","五","六") -> 三 | C26: 1204584
A27: =A26+1 -> 39380 | B27: =CHOOSE(WEEKDAY(A27,1),"日","一","二","三","四","五","六") -> 四 | C27: 1213736
A28: =A27+1 -> 39381 | B28: =CHOOSE(WEEKDAY(A28,1),"日","一","二","三","四","五","六") -> 五 | C28: 1334082
A29: =A28+1 -> 39382 | B29: =CHOOSE(WEEKDAY(A29,1),"日","一","二","三","四","五","六") -> 六 | C29: 1231004
A30: =A29+1 -> 39383 | B30: =CHOOSE(WEEKDAY(A30,1),"日","一","二","三","四","五","六") -> 日 | C30: 1016284
A31: =A30+1 -> 39384 | B31: =CHOOSE(WEEKDAY(A31,1),"日","一","二","三","四","五","六") -> 一 | C31: 1179392
A32: =A31+1 -> 39385 | B32: =CHOOSE(WEEKDAY(A32,1),"日","一","二","三","四","五","六") -> 二 | C32: 1190613
A33: =A32+1 -> 39386 | B33: =CHOOSE(WEEKDAY(A33,1),"日","一","二","三","四","五","六") -> 三 | C33: 1199854
A34: 當月總計 | C34: =SUM(C3:C33) -> 35679396
A35: 日平均 | C35: =C34/31 -> 1150948.2580645161
C36: 單位：人次