A1: 臺北捷運公司運量統計表
A2: 營運日 | B2: 星期 | C2: 總 運 量
A3: 39387 | B3: =CHOOSE(WEEKDAY(A3,1),"日","一","二","三","四","五","六") -> 四 | C3: 1206311
A4: =A3+1 -> 39388 | B4: =CHOOSE(WEEKDAY(A4,1),"日","一","二","三","四","五","六") -> 五 | C4: 1326579
A5: =A4+1 -> 39389 | B5: =CHOOSE(WEEKDAY(A5,1),"日","一","二","三","四","五","六") -> 六 | C5: 1201287
A6: =A5+1 -> 39390 | B6: =CHOOSE(WEEKDAY(A6,1),"日","一","二","三","四","五","六") -> 日 | C6: 966576
A7: =A6+1 -> 39391 | B7: =CHOOSE(WEEKDAY(A7,1),"日","一","二","三","四","五","六") -> 一 | C7: 1188526
A8: =A7+1 -> 39392 | B8: =CHOOSE(WEEKDAY(A8,1),"日","一","二","三","四","五","六") -> 二 | C8: 1208594
A9: =A8+1 -> 39393 | B9: =CHOOSE(WEEKDAY(A9,1),"日","一","二","三","四","五","六") -> 三 | C9: 1231276
A10: =A9+1 -> 39394 | B10: =CHOOSE(WEEKDAY(A10,1),"日","一","二","三","四","五","六") -> 四 | C10: 1260448
A11: =A10+1 -> 39395 | B11: =CHOOSE(WEEKDAY(A11,1),"日","一","二","三","四","五","六") -> 五 | C11: 1367635
A12: =A11+1 -> 39396 | B12: =CHOOSE(WEEKDAY(A12,1),"日","一","二","三","四","五","六") -> 六 | C12: 1246040
A13: =A12+1 -> 39397 | B13: =CHOOSE(WEEKDAY(A13,1),"日","一","二","三","四","五","六") -> 日 | C13: 1040220
A14: =A13+1 -> 39398 | B14: =CHOOSE(WEEKDAY(A14,1),"日","一","二","三","四","五","六") -> 一 | C14: 1233452
A15: =A14+1 -> 39399 | B15: =CHOOSE(WEEKDAY(A15,1),"日","一","二","三","四","五","六") -> 二 | C15: 1225951
A16: =A15+1 -> 39400 | B16: =CHOOSE(WEEKDAY(A16,1),"日","一","二","三","四","五","六") -> 三 | C16: 1240456
A17: =A16+1 -> 39401 | B17: =CHOOSE(WEEKDAY(A17,1),"日","一","二","三","四","五","六") -> 四 | C17: 1239187
A18: =A17+1 -> 39402 | B18: =CHOOSE(WEEKDAY(A18,1),"日","一","二","三","四","五","六") -> 五 | C18: 1394139
A19: =A18+1 -> 39403 | B19: =CHOOSE(WEEKDAY(A19,1),"日","一","二","三","四","五","六") -> 六 | C19: 1259632
A20: =A19+1 -> 39404 | B20: =CHOOSE(WEEKDAY(A20,1),"日","一","二","三","四","五","六") -> 日 | C20: 999517
A21: =A20+1 -> 39405 | B21: =CHOOSE(WEEKDAY(A21,1),"日","一","二","三","四","五","六") -> 一 | C21: 1222870
A22: =A21+1 -> 39406 | B22: =CHOOSE(WEEKDAY(A22,1),"日","一","二","三","四","五","六") -> 二 | C22: 1207584
A23: =A22+1 -> 39407 | B23: =CHOOSE(WEEKDAY(A23,1),"日","一","二","三","四","五","六") -> 三 | C23: 1217655
A24: =A23+1 -> 39408 | B24: =CHOOSE(WEEKDAY(A24,1),"日","一","二","三","四","五","六") -> 四 | C24: 1230140
A25: =A24+1 -> 39409 | B25: =CHOOSE(WEEKDAY(A25,1),"日","一","二","三","四","五","六") -> 五 | C25: 1359990
A26: =A25+1 -> 39410 | B26: =CHOOSE(WEEKDAY(A26,1),"日","一","二","三","四","五","六") -> 六 | C26: 1179084
A27: =A26+1 -> 39411 | B27: =CHOOSE(WEEKDAY(A27,1),"日","一","二","三","四","五","六") -> 日 | C27: 970806
A28: =A27+1 -> 39412 | B28: =CHOOSE(WEEKDAY(A28,1),"日","一","二","三","四","五","六") -> 一 | C28: 1173227
A29: =A28+1 -> 39413 | B29: =CHOOSE(WEEKDAY(A29,1),"日","一","二","三","四","五","六") -> 二 | C29: 1179490
A30: =A29+1 -> 39414 | B30: =CHOOSE(WEEKDAY(A30,1),"日","一","二","三","四","五","六") -> 三 | C30: 1234438
A31: =A30+1 -> 39415 | B31: =CHOOSE(WEEKDAY(A31,1),"日","一","二","三","四","五","六") -> 四 | C31: 1242252
A32: =A31+1 -> 39416 | B32: =CHOOSE(WEEKDAY(A32,1),"日","一","二","三","四","五","六") -> 五 | C32: 1388468
A33: 當月總計 | C33: =SUM(C3:C32) -> 36441830
A34: 日平均 | C34: =C33/30 -> 1214727.6666666667
C35: 單位：人次