A1: 臺北捷運公司運量統計表
A2: 營運日 | B2: 星期 | C2: 總 運 量
A3: 39539 | B3: =CHOOSE(WEEKDAY(A3,1),"日","一","二","三","四","五","六") -> 二 | C3: 1253697
A4: =A3+1 -> 39540 | B4: =CHOOSE(WEEKDAY(A4,1),"日","一","二","三","四","五","六") -> 三 | C4: 1285375
A5: =A4+1 -> 39541 | B5: =CHOOSE(WEEKDAY(A5,1),"日","一","二","三","四","五","六") -> 四 | C5: 1340274
A6: =A5+1 -> 39542 | B6: =CHOOSE(WEEKDAY(A6,1),"日","一","二","三","四","五","六") -> 五 | C6: 911605
A7: =A6+1 -> 39543 | B7: =CHOOSE(WEEKDAY(A7,1),"日","一","二","三","四","五","六") -> 六 | C7: 1139725
A8: =A7+1 -> 39544 | B8: =CHOOSE(WEEKDAY(A8,1),"日","一","二","三","四","五","六") -> 日 | C8: 1006605
A9: =A8+1 -> 39545 | B9: =CHOOSE(WEEKDAY(A9,1),"日","一","二","三","四","五","六") -> 一 | C9: 1227724
A10: =A9+1 -> 39546 | B10: =CHOOSE(WEEKDAY(A10,1),"日","一","二","三","四","五","六") -> 二 | C10: 1240693
A11: =A10+1 -> 39547 | B11: =CHOOSE(WEEKDAY(A11,1),"日","一","二","三","四","五","六") -> 三 | C11: 1251054
A12: =A11+1 -> 39548 | B12: =CHOOSE(WEEKDAY(A12,1),"日","一","二","三","四","五","六") -> 四 | C12: 1267007
A13: =A12+1 -> 39549 | B13: =CHOOSE(WEEKDAY(A13,1),"日","一","二","三","四","五","六") -> 五 | C13: 1390965
A14: =A13+1 -> 39550 | B14: =CHOOSE(WEEKDAY(A14,1),"日","一","二","三","四","五","六") -> 六 | C14: 1270456
A15: =A14+1 -> 39551 | B15: =CHOOSE(WEEKDAY(A15,1),"日","一","二","三","四","五","六") -> 日 | C15: 1002826
A16: =A15+1 -> 39552 | B16: =CHOOSE(WEEKDAY(A16,1),"日","一","二","三","四","五","六") -> 一 | C16: 1215627
A17: =A16+1 -> 39553 | B17: =CHOOSE(WEEKDAY(A17,1),"日","一","二","三","四","五","六") -> 二 | C17: 1231369
A18: =A17+1 -> 39554 | B18: =CHOOSE(WEEKDAY(A18,1),"日","一","二","三","四","五","六") -> 三 | C18: 1237794
A19: =A18+1 -> 39555 | B19: =CHOOSE(WEEKDAY(A19,1),"日","一","二","三","四","五","六") -> 四 | C19: 1235826
A20: =A19+1 -> 39556 | B20: =CHOOSE(WEEKDAY(A20,1),"日","一","二","三","四","五","六") -> 五 | C20: 1358475
A21: =A20+1 -> 39557 | B21: =CHOOSE(WEEKDAY(A21,1),"日","一","二","三","四","五","六") -> 六 | C21: 1242580
A22: =A21+1 -> 39558 | B22: =CHOOSE(WEEKDAY(A22,1),"日","一","二","三","四","五","六") -> 日 | C22: 1022103
A23: =A22+1 -> 39559 | B23: =CHOOSE(WEEKDAY(A23,1),"日","一","二","三","四","五","六") -> 一 | C23: 1173241
A24: =A23+1 -> 39560 | B24: =CHOOSE(WEEKDAY(A24,1),"日","一","二","三","四","五","六") -> 二 | C24: 1220207
A25: =A24+1 -> 39561 | B25: =CHOOSE(WEEKDAY(A25,1),"日","一","二","三","四","五","六") -> 三 | C25: 1226036
A26: =A25+1 -> 39562 | B26: =CHOOSE(WEEKDAY(A26,1),"日","一","二","三","四","五","六") -> 四 | C26: 1237285
A27: =A26+1 -> 39563 | B27: =CHOOSE(WEEKDAY(A27,1),"日","一","二","三","四","五","六") -> 五 | C27: 1375691
A28: =A27+1 -> 39564 | B28: =CHOOSE(WEEKDAY(A28,1),"日","一","二","三","四","五","六") -> 六 | C28: 1306424
A29: =A28+1 -> 39565 | B29: =CHOOSE(WEEKDAY(A29,1),"日","一","二","三","四","五","六") -> 日 | C29: 1092885
A30: =A29+1 -> 39566 | B30: =CHOOSE(WEEKDAY(A30,1),"日","一","二","三","四","五","六") -> 一 | C30: 1223174
A31: =A30+1 -> 39567 | B31: =CHOOSE(WEEKDAY(A31,1),"日","一","二","三","四","五","六") -> 二 | C31: 1230471
A32: =A31+1 -> 39568 | B32: =CHOOSE(WEEKDAY(A32,1),"日","一","二","三","四","五","六") -> 三 | C32: 1254895
A33: 當月總計 | C33: =SUM(C3:C32) -> 36472089
A34: 日平均 | C34: =C33/30 -> 1215736.3
C35: 單位：人次