A1: 臺北捷運公司運量統計表
A2: 營運日 | B2: 星期 | C2: 總 運 量
A3: 39904 | B3: =CHOOSE(WEEKDAY(A3,1),"日","一","二","三","四","五","六") -> 三 | C3: 1273903
A4: =A3+1 -> 39905 | B4: =CHOOSE(WEEKDAY(A4,1),"日","一","二","三","四","五","六") -> 四 | C4: 1280784
A5: =A4+1 -> 39906 | B5: =CHOOSE(WEEKDAY(A5,1),"日","一","二","三","四","五","六") -> 五 | C5: 1379117
A6: =A5+1 -> 39907 | B6: =CHOOSE(WEEKDAY(A6,1),"日","一","二","三","四","五","六") -> 六 | C6: 1021506
A7: =A6+1 -> 39908 | B7: =CHOOSE(WEEKDAY(A7,1),"日","一","二","三","四","五","六") -> 日 | C7: 941658
A8: =A7+1 -> 39909 | B8: =CHOOSE(WEEKDAY(A8,1),"日","一","二","三","四","五","六") -> 一 | C8: 1259959
A9: =A8+1 -> 39910 | B9: =CHOOSE(WEEKDAY(A9,1),"日","一","二","三","四","五","六") -> 二 | C9: 1265961
A10: =A9+1 -> 39911 | B10: =CHOOSE(WEEKDAY(A10,1),"日","一","二","三","四","五","六") -> 三 | C10: 1302018
A11: =A10+1 -> 39912 | B11: =CHOOSE(WEEKDAY(A11,1),"日","一","二","三","四","五","六") -> 四 | C11: 1321840
A12: =A11+1 -> 39913 | B12: =CHOOSE(WEEKDAY(A12,1),"日","一","二","三","四","五","六") -> 五 | C12: 1450625
A13: =A12+1 -> 39914 | B13: =CHOOSE(WEEKDAY(A13,1),"日","一","二","三","四","五","六") -> 六 | C13: 1372335
A14: =A13+1 -> 39915 | B14: =CHOOSE(WEEKDAY(A14,1),"日","一","二","三","四","五","六") -> 日 | C14: 1153947
A15: =A14+1 -> 39916 | B15: =CHOOSE(WEEKDAY(A15,1),"日","一","二","三","四","五","六") -> 一 | C15: 1250570
A16: =A15+1 -> 39917 | B16: =CHOOSE(WEEKDAY(A16,1),"日","一","二","三","四","五","六") -> 二 | C16: 1266858
A17: =A16+1 -> 39918 | B17: =CHOOSE(WEEKDAY(A17,1),"日","一","二","三","四","五","六") -> 三 | C17: 1290995
A18: =A17+1 -> 39919 | B18: =CHOOSE(WEEKDAY(A18,1),"日","一","二","三","四","五","六") -> 四 | C18: 1289692
A19: =A18+1 -> 39920 | B19: =CHOOSE(WEEKDAY(A19,1),"日","一","二","三","四","五","六") -> 五 | C19: 1403585
A20: =A19+1 -> 39921 | B20: =CHOOSE(WEEKDAY(A20,1),"日","一","二","三","四","五","六") -> 六 | C20: 1279995
A21: =A20+1 -> 39922 | B21: =CHOOSE(WEEKDAY(A21,1),"日","一","二","三","四","五","六") -> 日 | C21: 1051565
A22: =A21+1 -> 39923 | B22: =CHOOSE(WEEKDAY(A22,1),"日","一","二","三","四","五","六") -> 一 | C22: 1224015
A23: =A22+1 -> 39924 | B23: =CHOOSE(WEEKDAY(A23,1),"日","一","二","三","四","五","六") -> 二 | C23: 1240131
A24: =A23+1 -> 39925 | B24: =CHOOSE(WEEKDAY(A24,1),"日","一","二","三","四","五","六") -> 三 | C24: 1257321
A25: =A24+1 -> 39926 | B25: =CHOOSE(WEEKDAY(A25,1),"日","一","二","三","四","五","六") -> 四 | C25: 1274721
A26: =A25+1 -> 39927 | B26: =CHOOSE(WEEKDAY(A26,1),"日","一","二","三","四","五","六") -> 五 | C26: 1398486
A27: =A26+1 -> 39928 | B27: =CHOOSE(WEEKDAY(A27,1),"日","一","二","三","四","五","六") -> 六 | C27: 1149690
A28: =A27+1 -> 39929 | B28: =CHOOSE(WEEKDAY(A28,1),"日","一","二","三","四","五","六") -> 日 | C28: 942165
A29: =A28+1 -> 39930 | B29: =CHOOSE(WEEKDAY(A29,1),"日","一","二","三","四","五","六") -> 一 | C29: 1238105
A30: =A29+1 -> 39931 | B30: =CHOOSE(WEEKDAY(A30,1),"日","一","二","三","四","五","六") -> 二 | C30: 1260480
A31: =A30+1 -> 39932 | B31: =CHOOSE(WEEKDAY(A31,1),"日","一","二","三","四","五","六") -> 三 | C31: 1268978
A32: =A31+1 -> 39933 | B32: =CHOOSE(WEEKDAY(A32,1),"日","一","二","三","四","五","六") -> 四 | C32: 1299413
A33: 當月總計 | C33: =SUM(C3:C32) -> 37410418
A34: 日平均 | C34: =C33/30 -> 1247013.9333333333
C35: 單位：人次