A1: 臺北捷運公司運量統計表
A2: 營運日 | B2: 星期 | C2: 總 運 量
A3: 39995 | B3: =CHOOSE(WEEKDAY(A3,1),"日","一","二","三","四","五","六") -> 三 | C3: 1311177
A4: =A3+1 -> 39996 | B4: =CHOOSE(WEEKDAY(A4,1),"日","一","二","三","四","五","六") -> 四 | C4: 1283600
A5: =A4+1 -> 39997 | B5: =CHOOSE(WEEKDAY(A5,1),"日","一","二","三","四","五","六") -> 五 | C5: 1387363
A6: =A5+1 -> 39998 | B6: =CHOOSE(WEEKDAY(A6,1),"日","一","二","三","四","五","六") -> 六 | C6: 1395673
A7: =A6+1 -> 39999 | B7: =CHOOSE(WEEKDAY(A7,1),"日","一","二","三","四","五","六") -> 日 | C7: 1215576
A8: =A7+1 -> 40000 | B8: =CHOOSE(WEEKDAY(A8,1),"日","一","二","三","四","五","六") -> 一 | C8: 1411561
A9: =A8+1 -> 40001 | B9: =CHOOSE(WEEKDAY(A9,1),"日","一","二","三","四","五","六") -> 二 | C9: 1378126
A10: =A9+1 -> 40002 | B10: =CHOOSE(WEEKDAY(A10,1),"日","一","二","三","四","五","六") -> 三 | C10: 1387666
A11: =A10+1 -> 40003 | B11: =CHOOSE(WEEKDAY(A11,1),"日","一","二","三","四","五","六") -> 四 | C11: 1401001
A12: =A11+1 -> 40004 | B12: =CHOOSE(WEEKDAY(A12,1),"日","一","二","三","四","五","六") -> 五 | C12: 1412756
A13: =A12+1 -> 40005 | B13: =CHOOSE(WEEKDAY(A13,1),"日","一","二","三","四","五","六") -> 六 | C13: 1305419
A14: =A13+1 -> 40006 | B14: =CHOOSE(WEEKDAY(A14,1),"日","一","二","三","四","五","六") -> 日 | C14: 1126208
A15: =A14+1 -> 40007 | B15: =CHOOSE(WEEKDAY(A15,1),"日","一","二","三","四","五","六") -> 一 | C15: 1343982
A16: =A15+1 -> 40008 | B16: =CHOOSE(WEEKDAY(A16,1),"日","一","二","三","四","五","六") -> 二 | C16: 1332292
A17: =A16+1 -> 40009 | B17: =CHOOSE(WEEKDAY(A17,1),"日","一","二","三","四","五","六") -> 三 | C17: 1396396
A18: =A17+1 -> 40010 | B18: =CHOOSE(WEEKDAY(A18,1),"日","一","二","三","四","五","六") -> 四 | C18: 1373162
A19: =A18+1 -> 40011 | B19: =CHOOSE(WEEKDAY(A19,1),"日","一","二","三","四","五","六") -> 五 | C19: 1435352
A20: =A19+1 -> 40012 | B20: =CHOOSE(WEEKDAY(A20,1),"日","一","二","三","四","五","六") -> 六 | C20: 1257784
A21: =A20+1 -> 40013 | B21: =CHOOSE(WEEKDAY(A21,1),"日","一","二","三","四","五","六") -> 日 | C21: 1090551
A22: =A21+1 -> 40014 | B22: =CHOOSE(WEEKDAY(A22,1),"日","一","二","三","四","五","六") -> 一 | C22: 1313986
A23: =A22+1 -> 40015 | B23: =CHOOSE(WEEKDAY(A23,1),"日","一","二","三","四","五","六") -> 二 | C23: 1342331
A24: =A23+1 -> 40016 | B24: =CHOOSE(WEEKDAY(A24,1),"日","一","二","三","四","五","六") -> 三 | C24: 1363449
A25: =A24+1 -> 40017 | B25: =CHOOSE(WEEKDAY(A25,1),"日","一","二","三","四","五","六") -> 四 | C25: 1349398
A26: =A25+1 -> 40018 | B26: =CHOOSE(WEEKDAY(A26,1),"日","一","二","三","四","五","六") -> 五 | C26: 1427245
A27: =A26+1 -> 40019 | B27: =CHOOSE(WEEKDAY(A27,1),"日","一","二","三","四","五","六") -> 六 | C27: 1233971
A28: =A27+1 -> 40020 | B28: =CHOOSE(WEEKDAY(A28,1),"日","一","二","三","四","五","六") -> 日 | C28: 1086568
A29: =A28+1 -> 40021 | B29: =CHOOSE(WEEKDAY(A29,1),"日","一","二","三","四","五","六") -> 一 | C29: 1294775
A30: =A29+1 -> 40022 | B30: =CHOOSE(WEEKDAY(A30,1),"日","一","二","三","四","五","六") -> 二 | C30: 1323919
A31: =A30+1 -> 40023 | B31: =CHOOSE(WEEKDAY(A31,1),"日","一","二","三","四","五","六") -> 三 | C31: 1348638
A32: =A31+1 -> 40024 | B32: =CHOOSE(WEEKDAY(A32,1),"日","一","二","三","四","五","六") -> 四 | C32: 1356310
A33: =A32+1 -> 40025 | B33: =CHOOSE(WEEKDAY(A33,1),"日","一","二","三","四","五","六") -> 五 | C33: 1437062
A34: 當月總計 | C34: =SUM(C3:C33) -> 41123297
A35: 日平均 | C35: =C34/31 -> 1326557.9677419355
C36: 單位：人次