A1: 臺北捷運公司運量統計表
A2: 營運日 | B2: 星期 | C2: 總 運 量
A3: 40026 | B3: =CHOOSE(WEEKDAY(A3,1),"日","一","二","三","四","五","六") -> 六 | C3: 1311686
A4: =A3+1 -> 40027 | B4: =CHOOSE(WEEKDAY(A4,1),"日","一","二","三","四","五","六") -> 日 | C4: 1125673
A5: =A4+1 -> 40028 | B5: =CHOOSE(WEEKDAY(A5,1),"日","一","二","三","四","五","六") -> 一 | C5: 1296684
A6: =A5+1 -> 40029 | B6: =CHOOSE(WEEKDAY(A6,1),"日","一","二","三","四","五","六") -> 二 | C6: 1302308
A7: =A6+1 -> 40030 | B7: =CHOOSE(WEEKDAY(A7,1),"日","一","二","三","四","五","六") -> 三 | C7: 1353510
A8: =A7+1 -> 40031 | B8: =CHOOSE(WEEKDAY(A8,1),"日","一","二","三","四","五","六") -> 四 | C8: 1239729
A9: =A8+1 -> 40032 | B9: =CHOOSE(WEEKDAY(A9,1),"日","一","二","三","四","五","六") -> 五 | C9: 267406
A10: =A9+1 -> 40033 | B10: =CHOOSE(WEEKDAY(A10,1),"日","一","二","三","四","五","六") -> 六 | C10: 778340
A11: =A10+1 -> 40034 | B11: =CHOOSE(WEEKDAY(A11,1),"日","一","二","三","四","五","六") -> 日 | C11: 926708
A12: =A11+1 -> 40035 | B12: =CHOOSE(WEEKDAY(A12,1),"日","一","二","三","四","五","六") -> 一 | C12: 1322415
A13: =A12+1 -> 40036 | B13: =CHOOSE(WEEKDAY(A13,1),"日","一","二","三","四","五","六") -> 二 | C13: 1363719
A14: =A13+1 -> 40037 | B14: =CHOOSE(WEEKDAY(A14,1),"日","一","二","三","四","五","六") -> 三 | C14: 1329268
A15: =A14+1 -> 40038 | B15: =CHOOSE(WEEKDAY(A15,1),"日","一","二","三","四","五","六") -> 四 | C15: 1408347
A16: =A15+1 -> 40039 | B16: =CHOOSE(WEEKDAY(A16,1),"日","一","二","三","四","五","六") -> 五 | C16: 1524261
A17: =A16+1 -> 40040 | B17: =CHOOSE(WEEKDAY(A17,1),"日","一","二","三","四","五","六") -> 六 | C17: 1314638
A18: =A17+1 -> 40041 | B18: =CHOOSE(WEEKDAY(A18,1),"日","一","二","三","四","五","六") -> 日 | C18: 1121186
A19: =A18+1 -> 40042 | B19: =CHOOSE(WEEKDAY(A19,1),"日","一","二","三","四","五","六") -> 一 | C19: 1349913
A20: =A19+1 -> 40043 | B20: =CHOOSE(WEEKDAY(A20,1),"日","一","二","三","四","五","六") -> 二 | C20: 1337902
A21: =A20+1 -> 40044 | B21: =CHOOSE(WEEKDAY(A21,1),"日","一","二","三","四","五","六") -> 三 | C21: 1366668
A22: =A21+1 -> 40045 | B22: =CHOOSE(WEEKDAY(A22,1),"日","一","二","三","四","五","六") -> 四 | C22: 1365533
A23: =A22+1 -> 40046 | B23: =CHOOSE(WEEKDAY(A23,1),"日","一","二","三","四","五","六") -> 五 | C23: 1425877
A24: =A23+1 -> 40047 | B24: =CHOOSE(WEEKDAY(A24,1),"日","一","二","三","四","五","六") -> 六 | C24: 1161538
A25: =A24+1 -> 40048 | B25: =CHOOSE(WEEKDAY(A25,1),"日","一","二","三","四","五","六") -> 日 | C25: 991639
A26: =A25+1 -> 40049 | B26: =CHOOSE(WEEKDAY(A26,1),"日","一","二","三","四","五","六") -> 一 | C26: 1310845
A27: =A26+1 -> 40050 | B27: =CHOOSE(WEEKDAY(A27,1),"日","一","二","三","四","五","六") -> 二 | C27: 1343149
A28: =A27+1 -> 40051 | B28: =CHOOSE(WEEKDAY(A28,1),"日","一","二","三","四","五","六") -> 三 | C28: 1384742
A29: =A28+1 -> 40052 | B29: =CHOOSE(WEEKDAY(A29,1),"日","一","二","三","四","五","六") -> 四 | C29: 1322834
A30: =A29+1 -> 40053 | B30: =CHOOSE(WEEKDAY(A30,1),"日","一","二","三","四","五","六") -> 五 | C30: 1369854
A31: =A30+1 -> 40054 | B31: =CHOOSE(WEEKDAY(A31,1),"日","一","二","三","四","五","六") -> 六 | C31: 1071313
A32: =A31+1 -> 40055 | B32: =CHOOSE(WEEKDAY(A32,1),"日","一","二","三","四","五","六") -> 日 | C32: 870498
A33: =A32+1 -> 40056 | B33: =CHOOSE(WEEKDAY(A33,1),"日","一","二","三","四","五","六") -> 一 | C33: 1237616
A34: 當月總計 | C34: =SUM(C3:C33) -> 37895799
A35: 日平均 | C35: =C34/31 -> 1222445.1290322582
C36: 單位：人次