A1: 臺北捷運公司運量統計表
A2: 營運日 | B2: 星期 | C2: 總 運 量
A3: 40087 | B3: =CHOOSE(WEEKDAY(A3,1),"日","一","二","三","四","五","六") -> 四 | C3: 1354178
A4: =A3+1 -> 40088 | B4: =CHOOSE(WEEKDAY(A4,1),"日","一","二","三","四","五","六") -> 五 | C4: 1487572
A5: =A4+1 -> 40089 | B5: =CHOOSE(WEEKDAY(A5,1),"日","一","二","三","四","五","六") -> 六 | C5: 900152
A6: =A5+1 -> 40090 | B6: =CHOOSE(WEEKDAY(A6,1),"日","一","二","三","四","五","六") -> 日 | C6: 830821
A7: =A6+1 -> 40091 | B7: =CHOOSE(WEEKDAY(A7,1),"日","一","二","三","四","五","六") -> 一 | C7: 1227392
A8: =A7+1 -> 40092 | B8: =CHOOSE(WEEKDAY(A8,1),"日","一","二","三","四","五","六") -> 二 | C8: 1306834
A9: =A8+1 -> 40093 | B9: =CHOOSE(WEEKDAY(A9,1),"日","一","二","三","四","五","六") -> 三 | C9: 1347328
A10: =A9+1 -> 40094 | B10: =CHOOSE(WEEKDAY(A10,1),"日","一","二","三","四","五","六") -> 四 | C10: 1381259
A11: =A10+1 -> 40095 | B11: =CHOOSE(WEEKDAY(A11,1),"日","一","二","三","四","五","六") -> 五 | C11: 1503710
A12: =A11+1 -> 40096 | B12: =CHOOSE(WEEKDAY(A12,1),"日","一","二","三","四","五","六") -> 六 | C12: 1225378
A13: =A12+1 -> 40097 | B13: =CHOOSE(WEEKDAY(A13,1),"日","一","二","三","四","五","六") -> 日 | C13: 1023177
A14: =A13+1 -> 40098 | B14: =CHOOSE(WEEKDAY(A14,1),"日","一","二","三","四","五","六") -> 一 | C14: 1312603
A15: =A14+1 -> 40099 | B15: =CHOOSE(WEEKDAY(A15,1),"日","一","二","三","四","五","六") -> 二 | C15: 1333633
A16: =A15+1 -> 40100 | B16: =CHOOSE(WEEKDAY(A16,1),"日","一","二","三","四","五","六") -> 三 | C16: 1354451
A17: =A16+1 -> 40101 | B17: =CHOOSE(WEEKDAY(A17,1),"日","一","二","三","四","五","六") -> 四 | C17: 1355834
A18: =A17+1 -> 40102 | B18: =CHOOSE(WEEKDAY(A18,1),"日","一","二","三","四","五","六") -> 五 | C18: 1493366
A19: =A18+1 -> 40103 | B19: =CHOOSE(WEEKDAY(A19,1),"日","一","二","三","四","五","六") -> 六 | C19: 1406962
A20: =A19+1 -> 40104 | B20: =CHOOSE(WEEKDAY(A20,1),"日","一","二","三","四","五","六") -> 日 | C20: 1174799
A21: =A20+1 -> 40105 | B21: =CHOOSE(WEEKDAY(A21,1),"日","一","二","三","四","五","六") -> 一 | C21: 1307175
A22: =A21+1 -> 40106 | B22: =CHOOSE(WEEKDAY(A22,1),"日","一","二","三","四","五","六") -> 二 | C22: 1326397
A23: =A22+1 -> 40107 | B23: =CHOOSE(WEEKDAY(A23,1),"日","一","二","三","四","五","六") -> 三 | C23: 1331571
A24: =A23+1 -> 40108 | B24: =CHOOSE(WEEKDAY(A24,1),"日","一","二","三","四","五","六") -> 四 | C24: 1339290
A25: =A24+1 -> 40109 | B25: =CHOOSE(WEEKDAY(A25,1),"日","一","二","三","四","五","六") -> 五 | C25: 1471304
A26: =A25+1 -> 40110 | B26: =CHOOSE(WEEKDAY(A26,1),"日","一","二","三","四","五","六") -> 六 | C26: 1254175
A27: =A26+1 -> 40111 | B27: =CHOOSE(WEEKDAY(A27,1),"日","一","二","三","四","五","六") -> 日 | C27: 1131464
A28: =A27+1 -> 40112 | B28: =CHOOSE(WEEKDAY(A28,1),"日","一","二","三","四","五","六") -> 一 | C28: 1309333
A29: =A28+1 -> 40113 | B29: =CHOOSE(WEEKDAY(A29,1),"日","一","二","三","四","五","六") -> 二 | C29: 1339373
A30: =A29+1 -> 40114 | B30: =CHOOSE(WEEKDAY(A30,1),"日","一","二","三","四","五","六") -> 三 | C30: 1352306
A31: =A30+1 -> 40115 | B31: =CHOOSE(WEEKDAY(A31,1),"日","一","二","三","四","五","六") -> 四 | C31: 1350566
A32: =A31+1 -> 40116 | B32: =CHOOSE(WEEKDAY(A32,1),"日","一","二","三","四","五","六") -> 五 | C32: 1492319
A33: =A32+1 -> 40117 | B33: =CHOOSE(WEEKDAY(A33,1),"日","一","二","三","四","五","六") -> 六 | C33: 1401538
A34: 當月總計 | C34: =SUM(C3:C33) -> 40426260
A35: 日平均 | C35: =C34/31 -> 1304072.9032258065
C36: 單位：人次