A1: 臺北捷運公司運量統計表
A2: 營運日 | B2: 星期 | C2: 總 運 量
A3: 40118 | B3: =CHOOSE(WEEKDAY(A3,1),"日","一","二","三","四","五","六") -> 日 | C3: 1051007
A4: =A3+1 -> 40119 | B4: =CHOOSE(WEEKDAY(A4,1),"日","一","二","三","四","五","六") -> 一 | C4: 1304406
A5: =A4+1 -> 40120 | B5: =CHOOSE(WEEKDAY(A5,1),"日","一","二","三","四","五","六") -> 二 | C5: 1298102
A6: =A5+1 -> 40121 | B6: =CHOOSE(WEEKDAY(A6,1),"日","一","二","三","四","五","六") -> 三 | C6: 1307592
A7: =A6+1 -> 40122 | B7: =CHOOSE(WEEKDAY(A7,1),"日","一","二","三","四","五","六") -> 四 | C7: 1361032
A8: =A7+1 -> 40123 | B8: =CHOOSE(WEEKDAY(A8,1),"日","一","二","三","四","五","六") -> 五 | C8: 1508564
A9: =A8+1 -> 40124 | B9: =CHOOSE(WEEKDAY(A9,1),"日","一","二","三","四","五","六") -> 六 | C9: 1425476
A10: =A9+1 -> 40125 | B10: =CHOOSE(WEEKDAY(A10,1),"日","一","二","三","四","五","六") -> 日 | C10: 1099962
A11: =A10+1 -> 40126 | B11: =CHOOSE(WEEKDAY(A11,1),"日","一","二","三","四","五","六") -> 一 | C11: 1330344
A12: =A11+1 -> 40127 | B12: =CHOOSE(WEEKDAY(A12,1),"日","一","二","三","四","五","六") -> 二 | C12: 1332359
A13: =A12+1 -> 40128 | B13: =CHOOSE(WEEKDAY(A13,1),"日","一","二","三","四","五","六") -> 三 | C13: 1357936
A14: =A13+1 -> 40129 | B14: =CHOOSE(WEEKDAY(A14,1),"日","一","二","三","四","五","六") -> 四 | C14: 1346467
A15: =A14+1 -> 40130 | B15: =CHOOSE(WEEKDAY(A15,1),"日","一","二","三","四","五","六") -> 五 | C15: 1497744
A16: =A15+1 -> 40131 | B16: =CHOOSE(WEEKDAY(A16,1),"日","一","二","三","四","五","六") -> 六 | C16: 1342259
A17: =A16+1 -> 40132 | B17: =CHOOSE(WEEKDAY(A17,1),"日","一","二","三","四","五","六") -> 日 | C17: 1142222
A18: =A17+1 -> 40133 | B18: =CHOOSE(WEEKDAY(A18,1),"日","一","二","三","四","五","六") -> 一 | C18: 1338627
A19: =A18+1 -> 40134 | B19: =CHOOSE(WEEKDAY(A19,1),"日","一","二","三","四","五","六") -> 二 | C19: 1326076
A20: =A19+1 -> 40135 | B20: =CHOOSE(WEEKDAY(A20,1),"日","一","二","三","四","五","六") -> 三 | C20: 1355877
A21: =A20+1 -> 40136 | B21: =CHOOSE(WEEKDAY(A21,1),"日","一","二","三","四","五","六") -> 四 | C21: 1354857
A22: =A21+1 -> 40137 | B22: =CHOOSE(WEEKDAY(A22,1),"日","一","二","三","四","五","六") -> 五 | C22: 1493332
A23: =A22+1 -> 40138 | B23: =CHOOSE(WEEKDAY(A23,1),"日","一","二","三","四","五","六") -> 六 | C23: 1321145
A24: =A23+1 -> 40139 | B24: =CHOOSE(WEEKDAY(A24,1),"日","一","二","三","四","五","六") -> 日 | C24: 1057529
A25: =A24+1 -> 40140 | B25: =CHOOSE(WEEKDAY(A25,1),"日","一","二","三","四","五","六") -> 一 | C25: 1314356
A26: =A25+1 -> 40141 | B26: =CHOOSE(WEEKDAY(A26,1),"日","一","二","三","四","五","六") -> 二 | C26: 1322938
A27: =A26+1 -> 40142 | B27: =CHOOSE(WEEKDAY(A27,1),"日","一","二","三","四","五","六") -> 三 | C27: 1352561
A28: =A27+1 -> 40143 | B28: =CHOOSE(WEEKDAY(A28,1),"日","一","二","三","四","五","六") -> 四 | C28: 1354099
A29: =A28+1 -> 40144 | B29: =CHOOSE(WEEKDAY(A29,1),"日","一","二","三","四","五","六") -> 五 | C29: 1498044
A30: =A29+1 -> 40145 | B30: =CHOOSE(WEEKDAY(A30,1),"日","一","二","三","四","五","六") -> 六 | C30: 1309589
A31: =A30+1 -> 40146 | B31: =CHOOSE(WEEKDAY(A31,1),"日","一","二","三","四","五","六") -> 日 | C31: 1131008
A32: =A31+1 -> 40147 | B32: =CHOOSE(WEEKDAY(A32,1),"日","一","二","三","四","五","六") -> 一 | C32: 1313137
A33: 當月總計 | C33: =SUM(C3:C32) -> 39548647
A34: 日平均 | C34: =C33/30 -> 1318288.2333333334
C35: 單位：人次