A1: 臺北捷運公司運量統計表
A2: 營運日 | B2: 星期 | C2: 總 運 量
A3: 40179 | B3: =CHOOSE(WEEKDAY(A3,1),"日","一","二","三","四","五","六") -> 五 | C3: 1284566
A4: =A3+1 -> 40180 | B4: =CHOOSE(WEEKDAY(A4,1),"日","一","二","三","四","五","六") -> 六 | C4: 1202744
A5: =A4+1 -> 40181 | B5: =CHOOSE(WEEKDAY(A5,1),"日","一","二","三","四","五","六") -> 日 | C5: 1003810
A6: =A5+1 -> 40182 | B6: =CHOOSE(WEEKDAY(A6,1),"日","一","二","三","四","五","六") -> 一 | C6: 1320725
A7: =A6+1 -> 40183 | B7: =CHOOSE(WEEKDAY(A7,1),"日","一","二","三","四","五","六") -> 二 | C7: 1342640
A8: =A7+1 -> 40184 | B8: =CHOOSE(WEEKDAY(A8,1),"日","一","二","三","四","五","六") -> 三 | C8: 1357258
A9: =A8+1 -> 40185 | B9: =CHOOSE(WEEKDAY(A9,1),"日","一","二","三","四","五","六") -> 四 | C9: 1362447
A10: =A9+1 -> 40186 | B10: =CHOOSE(WEEKDAY(A10,1),"日","一","二","三","四","五","六") -> 五 | C10: 1484849
A11: =A10+1 -> 40187 | B11: =CHOOSE(WEEKDAY(A11,1),"日","一","二","三","四","五","六") -> 六 | C11: 1251924
A12: =A11+1 -> 40188 | B12: =CHOOSE(WEEKDAY(A12,1),"日","一","二","三","四","五","六") -> 日 | C12: 1057674
A13: =A12+1 -> 40189 | B13: =CHOOSE(WEEKDAY(A13,1),"日","一","二","三","四","五","六") -> 一 | C13: 1310349
A14: =A13+1 -> 40190 | B14: =CHOOSE(WEEKDAY(A14,1),"日","一","二","三","四","五","六") -> 二 | C14: 1321806
A15: =A14+1 -> 40191 | B15: =CHOOSE(WEEKDAY(A15,1),"日","一","二","三","四","五","六") -> 三 | C15: 1347303
A16: =A15+1 -> 40192 | B16: =CHOOSE(WEEKDAY(A16,1),"日","一","二","三","四","五","六") -> 四 | C16: 1369420
A17: =A16+1 -> 40193 | B17: =CHOOSE(WEEKDAY(A17,1),"日","一","二","三","四","五","六") -> 五 | C17: 1504923
A18: =A17+1 -> 40194 | B18: =CHOOSE(WEEKDAY(A18,1),"日","一","二","三","四","五","六") -> 六 | C18: 1288528
A19: =A18+1 -> 40195 | B19: =CHOOSE(WEEKDAY(A19,1),"日","一","二","三","四","五","六") -> 日 | C19: 1052896
A20: =A19+1 -> 40196 | B20: =CHOOSE(WEEKDAY(A20,1),"日","一","二","三","四","五","六") -> 一 | C20: 1329366
A21: =A20+1 -> 40197 | B21: =CHOOSE(WEEKDAY(A21,1),"日","一","二","三","四","五","六") -> 二 | C21: 1363652
A22: =A21+1 -> 40198 | B22: =CHOOSE(WEEKDAY(A22,1),"日","一","二","三","四","五","六") -> 三 | C22: 1502033
A23: =A22+1 -> 40199 | B23: =CHOOSE(WEEKDAY(A23,1),"日","一","二","三","四","五","六") -> 四 | C23: 1392587
A24: =A23+1 -> 40200 | B24: =CHOOSE(WEEKDAY(A24,1),"日","一","二","三","四","五","六") -> 五 | C24: 1477618
A25: =A24+1 -> 40201 | B25: =CHOOSE(WEEKDAY(A25,1),"日","一","二","三","四","五","六") -> 六 | C25: 1272534
A26: =A25+1 -> 40202 | B26: =CHOOSE(WEEKDAY(A26,1),"日","一","二","三","四","五","六") -> 日 | C26: 1096330
A27: =A26+1 -> 40203 | B27: =CHOOSE(WEEKDAY(A27,1),"日","一","二","三","四","五","六") -> 一 | C27: 1330158
A28: =A27+1 -> 40204 | B28: =CHOOSE(WEEKDAY(A28,1),"日","一","二","三","四","五","六") -> 二 | C28: 1383307
A29: =A28+1 -> 40205 | B29: =CHOOSE(WEEKDAY(A29,1),"日","一","二","三","四","五","六") -> 三 | C29: 1426438
A30: =A29+1 -> 40206 | B30: =CHOOSE(WEEKDAY(A30,1),"日","一","二","三","四","五","六") -> 四 | C30: 1416095
A31: =A30+1 -> 40207 | B31: =CHOOSE(WEEKDAY(A31,1),"日","一","二","三","四","五","六") -> 五 | C31: 1502302
A32: =A31+1 -> 40208 | B32: =CHOOSE(WEEKDAY(A32,1),"日","一","二","三","四","五","六") -> 六 | C32: 1380465
A33: =A32+1 -> 40209 | B33: =CHOOSE(WEEKDAY(A33,1),"日","一","二","三","四","五","六") -> 日 | C33: 1179716
A34: 當月總計 | C34: =SUM(C3:C33) -> 40916463
A35: 日平均 | C35: =C34/31 -> 1319885.9032258065
C36: 單位：人次